description,code|1,code|1|type,code|2,code|2|type,code|3,code|3|type,code|4,code|4|type,setting,drug_unit_of_measurement,drug_type_of_measurement,standard_charge|gross,standard_charge|discounted_cash,payer_name,plan_name,modifiers,standard_charge|negotiated_dollar,standard_charge|negotiated_percentage,standard_charge|negotiated_algorithm,estimated_amount,standard_charge|min,standard_charge|max,standard_charge|methodology,additional_generic_notes,service|type,code|1|description,code|2|description,clinical_domain,pricing|discounted,pricing|gross,description_clean
SPHINCTEROTOME DASH 5.5FR 480CM .021IN DOME TIP TRACER METRO DIRECT BILIARY,SUP-64935,CDM,,,272.0,RC,,,outpatient,,,861.0,645.75,WELLSENSE [1003],WELLSENSE BOSTON CHILDREN'S ACO [100317],,,,,861.0,,,other,APC grouping requires price history; No contract line matched,CDM,Unknown,Unknown,Unknown,0.0004155787842647922,,sphincterotome dash 55fr 480cm 021in dome tip tracer metro direct biliary
Image Cath Fluid Peri/Retro,PX-76001947,CDM,49406,CPT,761.0,RC,,,inpatient,,,4320.0,3240.0,HARVARD PILGRIM [120001],HARVARD PILGRIM STUDENT RESOURCES [12000106],,,,,,,,,,CPT,Unknown,Unknown,Unknown,0.0020851598247438353,,image cath fluid periretro
Thpy Inf Transcath Thromb Sub Day,PX-76001834,CDM,37213,CPT,361.0,RC,,,inpatient,,,2173.0,1629.75,VETERANS ADMINISTRATION [160006],VETERANS ADMINISTRATION OF RI [16000602],,,,,,,,,,CPT,Unknown,Unknown,Unknown,0.0010488515003990808,,thpy inf transcath thromb sub day
Hydroxyindolacetic 5-(Hiaa),PX-30000516,CDM,83497,CPT,301.0,RC,,,outpatient,,,208.0,156.0,AETNA [1001],AETNA HMO MEDICARE REPLACEMENT [100109],,13.29,,,13.29,12.64,96.72,fee schedule,,CPT,Unknown,Unknown,Unknown,0.00010039045832295497,,hydroxyindolacetic 5hiaa
Pf Annual Depression Screening 15,PX-98300595,CDM,G0444,HCPCS,983.0,RC,,,outpatient,,,52.0,39.0,BLUE CROSS BLUE SHIELD [110001],BLUE CROSS NEW ENGLAND ANTHEM CT [11000136],,26.16,,,26.16,9.57,26.16,fee schedule,,HCPCS,Unknown,Unknown,Unknown,2.509278780698772e-05,,pf annual depression screening 15
MD Recertification Hha Pt,PX-96000022,CDM,G0179,HCPCS,969.0,RC,,,inpatient,,,190.0,142.5,CENTERS OF EXCELLENCE [1026],CIGNA TRANSPLANT [102602],,,,,,,,,,HCPCS,Unknown,Unknown,Unknown,9.17022655711126e-05,,md recertification hha pt
Fluor Antibody Titer,PX-30000813,CDM,86256,CPT,302.0,RC,,,outpatient,,,144.0,108.0,HARVARD PILGRIM [120001],HARVARD PILGRIM SIMPLY VIRTUAL [12000120],,32.14,,,32.14,11.81,90.5,fee schedule,,CPT,Unknown,Unknown,Unknown,6.949910631640431e-05,,fluor antibody titer
Colonoscopy Flex W/Balloon Dilat,PX-75000201,CDM,45386,CPT,750.0,RC,,,inpatient,,,2551.0,1913.25,TUFTS HEALTH PLAN [170001],TUFTS HMO [17000102],,,,,,,,,,CPT,Unknown,Unknown,Unknown,0.0012313035481877708,,colonoscopy flex wballoon dilat
CT Upr Ext W/O Contrast,PX-35000049,CDM,73200,CPT,352.0,RC,,,outpatient,,,2174.0,1630.5,HARVARD PILGRIM [120001],HPHC QUALITY LIMITED NTWK HMO [12000101],,112.51,,,293.65,112.51,750.32,other,Multiple Radiology,CPT,Unknown,Unknown,Unknown,0.0010493341777741833,,ct upr ext wo contrast
US Abdomen With IV Contrast,PX-40000145,CDM,C9744,HCPCS,402.0,RC,,,outpatient,,,1270.0,952.5,MARTIN'S POINT [160007],MARTIN'S POINT GENERATIONS ADV PPO POS MEDICARE REPLACEMENT [16000703],,,,,1270.0,,,other,APC grouping requires price history; No contract line matched,HCPCS,Unknown,Unknown,Unknown,0.0006129938306816551,,us abdomen iv contrast
DOCETAXEL 80 MG/4 ML (20 MG/ML) INTRAVENOUS SOLUTION,RX-108122,CDM,J9171,HCPCS,636.0,RC,16729-0267-64,NDC,inpatient,4.0,ML,364.79,273.59,TUFTS HEALTH PLAN [170001],TUFTS MEDICARE PREFERRED PPO REPLACEMENT [17000119],,,,,,,,,,HCPCS,Unknown,Unknown,Unknown,0.0001760678350406694,,docetaxel 80 mg4 ml 20 mgml intravenous solution
G160110 Sonivie Tivus Pulmonary Sympathetic Nerve Ultrasound System,PX-62400177,CDM,,,624.0,RC,,,inpatient,,,1.0,0.75,TUFTS HEALTH PLAN ALTERNATE [170002],TUFTS CARELINK HYBRID [17000203],,,,,,,,,,CDM,Unknown,Unknown,Unknown,4.762416767676562e-07,,g160110 sonivie tivus pulmonary sympathetic nerve ultrasound system
Insj/Rplc Cardiac Modulj Sys,PX-48000442,CDM,0408T,CPT,481.0,RC,,,inpatient,,,24333.0,18249.75,AETNA [1001],AETNA SCO DUAL MEDICARE REPLACEMENT [100115],,,,,,,,,,CPT,Unknown,Unknown,Unknown,0.011744982132667248,,insjrplc cardiac modulj sys
THORACOLUMBAR SPACER 12X6MM SYNMESH MESH ROUND HEIGHT TI,SUP-44356,CDM,C1889,HCPCS,278.0,RC,,,inpatient,,,2800.0,2100.0,CIGNA ALTERNATE [1018],TUFTS CIGNA CARELINK PREFERRED [101802],,,,,,,,,,HCPCS,Unknown,Unknown,Unknown,0.001351490214588257,,thoracolumbar spacer 12x6mm synmesh mesh round height ti
"Inj Anes/Ther Agent, Serratus Fascial Plane; Cont Inf via Cath",PX-76002916,CDM,64999,CPT,761.0,RC,,,inpatient,,,1142.0,856.5,COMMONWEALTH CARE ALLIANCE [1007],COMMONWEALTH CARE ALLIANCE PREF VALUE MEDICARE REPLACEMENT [100703],,,,,,,,,,CPT,Unknown,Unknown,Unknown,0.0005512111266685538,,inj anesther agent serratus fascial plane cont inf via cath
CATHETER BALLOON 2.75MM 1MM 20MM 150CM .018IN RE-ENTRY BTK ENTEER,SUP-441855,CDM,C1887,HCPCS,272.0,RC,,,inpatient,,,5375.0,4031.25,UNITED HEALTHCARE [1016],UNITED SCO COMMUNITY MEDICAID REPLACEMENT [101620],,,,,,,,,,HCPCS,Unknown,Unknown,Unknown,0.0025943844554768194,,catheter balloon 275mm 1mm 20mm 150cm 018in reentry btk enteer
CATHETER MONITORING 110CM 7FR .025IN PULMONARY ARTERY DOUBLE LUMEN HEPARIN BX/5EA,SUP-663770,CDM,,,272.0,RC,,,outpatient,,,132.3,99.22,HEALTH NEW ENGLAND ALTERNATE [1047],HEALTH NEW ENGLAND MBHP [104701],,,,,132.3,,,other,APC grouping requires price history; No contract line matched,CDM,Unknown,Unknown,Unknown,6.384856317853941e-05,,catheter monitoring 110cm 7fr 025in pulmonary artery double lumen heparin bx5ea
Inject Soln Sclerosing Leg Multi,PX-76001067,CDM,36471,CPT,761.0,RC,,,outpatient,,,675.0,506.25,INTERNATIONAL COMMERCIAL [140001],ONE TEAM HEALTH [14000119],,,65.0,,438.75,76.81,652.56,percent of total billed charges,,CPT,Unknown,Unknown,Unknown,0.00032580079249575435,,inject soln sclerosing leg multi
HYDROMORPHONE (PF) 1 MG/ML IN 0.9 % SODIUM CHLORIDE INTRAVENOUS SOLN,RX-197067,CDM,J7999,HCPCS,636.0,RC,70092-9546-35,NDC,inpatient,50.0,ML,155.98,116.98,TRICARE [160005],TRICARE EAST REGION PRIME [16000501],,,,,,,,,,HCPCS,Unknown,Unknown,Unknown,7.527836342096316e-05,,hydromorphone pf 1 mgml 09 sodium chloride intravenous soln
"Eosinophil Count, Urine",PX-30003546,CDM,85999,CPT,305.0,RC,,,inpatient,,,81.0,60.75,UNITED HEALTHCARE ALTERNATE [1020],UNITED HARVARD PILGRIM PREFERRED A [102002],,,,,,,,,,CPT,Unknown,Unknown,Unknown,3.909043168495599e-05,,eosinophil count urine
PLATE BONE 0.6MM 1 HOLE COMPRESSION CONDYLE 5 HOLD PIN RIGHT,SUP-115220,CDM,C1713,HCPCS,278.0,RC,,,inpatient,,,1484.0,1113.0,GENERIC MEDICARE REPLACEMENT [1010],WELLCARE PPO MEDICARE REPLACEMENT [101006],,,,,,,,,,HCPCS,Unknown,Unknown,Unknown,0.0007162867889535588,,plate bone 06mm 1 hole compression condyle 5 hold pin right
BOLT BONE 10X85MM FEMORAL NECK SYSTEM GOLD TI,SUP-666302,CDM,C1713,HCPCS,278.0,RC,,,inpatient,,,1062.53,796.9,MGB HEALTH PLAN [150001],MGB VALUE HMO [15000112],,,,,,,,,,HCPCS,Unknown,Unknown,Unknown,0.0005128543645937533,,bolt bone 10x85mm femoral neck system gold ti
SCREW BONE 6MM CANCELLOUS USS POLYAXIAL TITANIUM DUAL CORE 100MM THREAD,SUP-346562,CDM,C1713,HCPCS,278.0,RC,,,outpatient,,,157.5,118.12,MGB HEALTH PLAN [150001],MGB VALUE HMO [15000112],,,36.2,,57.02,,,percent of total billed charges,,HCPCS,Unknown,Unknown,Unknown,7.601203303111874e-05,,screw bone 6mm cancellous uss polyaxial titanium dual core 100mm thread
IXABEPILONE 15 MG INTRAVENOUS SOLUTION|DISCARDED DRUG NOT ADMINISTERED,RX-88652,CDM,J9207,HCPCS,636.0,RC,,,outpatient,7.6,ML,4694.78,3521.08,CIGNA ALTERNATE [1018],TUFTS CIGNA CARELINK NON PREFERRED [101803],JW,3434.91,,,3434.91,2322.0,4693.8,fee schedule,,HCPCS,Unknown,Unknown,Unknown,0.0022660544335355286,,ixabepilone 15 mg intravenous solutiondiscarded drug administered
Mgh Pax6 Gene Sequencing,PX-31000486,CDM,81479,CPT,310.0,RC,,,outpatient,,,1752.0,1314.0,MGB HEALTH PLAN [150001],MGBHP PPO [15000107],,,38.0,,665.76,134.8,134.8,percent of total billed charges,,CPT,Unknown,Unknown,Unknown,0.0008456443254809898,,mgh pax6 gene sequencing
"Aftercare, Musculoskeletal System And Connective Tissue With Cc",560,MS-DRG,,,,,,,inpatient,,,46336.17,34752.13,WELLPOINT [1015],WELLPOINT GIC DENTAL [101503],,16443.75,,,16443.75,5035.28,38148.91,case rate,,MS-DRG,Unknown,Unknown,Unknown,0.022365416081122698,,aftercare musculoskeletal system connective tissue cc
METHOTREXATE SODIUM 25 MG/ML INJECTION SOLUTION,RX-4974,CDM,J9260,HCPCS,636.0,RC,61703-0350-09,NDC,inpatient,2.0,ML,19.81,14.86,TUFTS HEALTH PLAN [170001],TUFTS SPIRIT OR SELECT [17000107],,,,,,,,,,HCPCS,Unknown,Unknown,Unknown,9.557012027026612e-06,,methotrexate sodium 25 mgml injection solution
Simultaneous Pancreas And Kidney Transplant,8,MS-DRG,,,,,,,inpatient,,,682640.2,511980.15,UNITED HEALTHCARE [1016],UNITED SCO COMMUNITY MEDICARE REPLACEMENT [101601],,41150.76,,"Wage-adjusted base payment rate plus any adjustments related to capital costs, indirect medical education (IME), disproportionate share hospital (DSH) adjustors, new technology, hemophilia, sole community hospital (SCH) and Medicare Dependent Hospital (MDH) adjustors, transfers, and outliers.",55727.45,41150.76,434770.31,other,Inpatient DRG,MS-DRG,Unknown,Unknown,Unknown,0.3294949734396478,,simultaneous pancreas kidney transplant
HC Salicylate (Analgesics Non-Opioid 3-5),PX-30002847,CDM,80330,CPT,301.0,RC,,,inpatient,,,230.0,172.5,HARVARD PILGRIM [120001],HPHC CONNECTORCARE [12000126],,,,,230.0,,,other,No contract line matched,CPT,Unknown,Unknown,Unknown,0.00011100936057520676,,hc salicylate analgesics nonopioid 35
ANCHOR SUTURE 5.5MM SIZE 2 INTRALINE TITANIUM FORCE FIBER,SUP-362464,CDM,C1713,HCPCS,278.0,RC,,,inpatient,,,987.04,740.28,BLUE CROSS BLUE SHIELD [110001],BLUE CROSS OUT OF STATE HMO [11000109],,,,,,,,,,HCPCS,Unknown,Unknown,Unknown,0.00047641544062269295,,anchor suture 55mm size 2 intraline titanium force fiber
SCREW BONE 7X80MM VIPER 5.5 TI SAI POLY,SUP-556871,CDM,C1713,HCPCS,278.0,RC,,,inpatient,,,2929.5,2197.12,GENERIC MEDICARE REPLACEMENT [1010],NEIGHBORHOOD HEALTH PLAN RI SCO MEDICARE REPLACEMENT [101008],,,,,,,,,,HCPCS,Unknown,Unknown,Unknown,0.0014139937168148444,,screw bone 7x80mm viper 55 ti sai poly
Assay of Lipoprotein A,PX-30000553,CDM,83695,CPT,301.0,RC,,,outpatient,,,153.0,114.75,HARVARD PILGRIM [120001],HPHC NH LOCAL HMO [12000122],,51.37,,,51.37,14.03,97.17,fee schedule,,CPT,Unknown,Unknown,Unknown,7.38432026923255e-05,,assay lipoprotein
BONE PLATE 2.7X63MM 8 HOLE TUBULAR ONE QUARTER WITH COLLAR LCP SS,SUP-112590,CDM,C1713,HCPCS,278.0,RC,,,inpatient,,,458.43,343.82,TUFTS HEALTH PLAN [170001],TUFTS MEDICARE PREFERRED PPO REPLACEMENT [17000119],,,,,,,,,,HCPCS,Unknown,Unknown,Unknown,0.00022126574444525384,,bone plate 27x63mm 8 hole tubular one quarter collar lcp ss
HC Meprobamate (Skeletal Muscle Relaxants 1 or 2),PX-30002886,CDM,80369,CPT,301.0,RC,,,inpatient,,,290.0,217.5,INTERNATIONAL COMMERCIAL [140001],GMMI [14000118],,,,,,44.21,44.21,,,CPT,Unknown,Unknown,Unknown,0.000139970003081348,,hc meprobamate skeletal muscle relaxants 1 2
DEXTROSE 5 % AND 0.9 % NACL IV BOLUS,RX-400294,CDM,J7042,HCPCS,636.0,RC,00338-0089-04,NDC,inpatient,1000.0,ML,8.5,6.37,FALLON HEALTH [1008],FALLON BERKSHIRE HEALTH COLLABORATIVE ACO [100811],,,,,,,,,,HCPCS,Unknown,Unknown,Unknown,4.093104140867963e-06,,dextrose 5 09 nacl iv bolus
Integra Drt,PX-63601043,CDM,Q4105,HCPCS,636.0,RC,,,inpatient,,,9704.0,7278.0,HARVARD PILGRIM [120001],HPHC ACCESS AMERICA [12000125],,,,,,,,,,HCPCS,Unknown,Unknown,Unknown,0.00468389481229491,,integra drt
Biopsy Endomyocardial,PX-48000131,CDM,93505,CPT,481.0,RC,,,outpatient,,,13574.0,10180.5,COVID19 HRSA UNINSURED TESTING AND TREATMENT FUND [160008],COVID19 HRSA UNINSURED TESTING AND TREATMENT FUND [16000801],,489.34,,,489.34,489.34,4277.35,fee schedule,,CPT,Unknown,Unknown,Unknown,0.006551856253941021,,biopsy endomyocardial
St Screening Language,PX-44000003,CDM,V5363,HCPCS,440.0,RC,,,inpatient,,,313.0,234.75,GENERIC MEDICARE REPLACEMENT [1010],MASS ADVANTAGE UMASS MEM MEDICARE REPLACEMENT [101005],,,,,,,,,,HCPCS,Unknown,Unknown,Unknown,0.00015107158270870214,,st screening language
"Brst Prsth Bra, Unilat Form T1",PX-27000965,CDM,L8001,HCPCS,274.0,RC,,,outpatient,,,525.0,393.75,MGB HEALTH PLAN [150001],MGBHP HMO MEDICARE REPLACEMENT [15000115],,,,,525.0,220.5,372.49,other,APC grouping requires price history; No contract line matched,HCPCS,Unknown,Unknown,Unknown,0.00025339918623040124,,brst prsth bra unilat form t1
STENT GRFT 39X20 XSEC 6MM IDSEC 5.3 ENDOVASCULAR INTRO SHEATH CONTRALATERAL IPSILATERAL Z TRAK INTRODUCTION SYST ILIAC,SUP-366740,CDM,C1874,HCPCS,278.0,RC,,,inpatient,,,9501.25,7125.94,MEDICAID NON MASSACHUSETTS [3002],NH MEDICAID [300205],,,,,,,,,,HCPCS,Unknown,Unknown,Unknown,0.004586033583417491,,stent grft 39x20 xsec 6mm idsec 53 endovascular intro sheath contralateral ipsilateral z trak introduction syst iliac
RADIUS PLATE PEG 10 HOLE RIGHT,SUP-375137,CDM,C1713,HCPCS,278.0,RC,,,outpatient,,,4515.0,3386.25,WELLPOINT [1015],WELLPOINT GIC DENTAL [101503],,,73.56,,3321.23,,,percent of total billed charges,,HCPCS,Unknown,Unknown,Unknown,0.0021792819128887944,,radius plate peg 10 hole right
Mgh Urnry Bile Salts Fab Ms,PX-30001606,CDM,84999,CPT,301.0,RC,,,outpatient,,,83.0,62.25,HARVARD PILGRIM [120001],HPHC ACCESS AMERICA [12000125],,,52.9,,43.91,20.96,33.71,percent of total billed charges,,CPT,Unknown,Unknown,Unknown,4.00557864351607e-05,,mgh urnry bile salts fab ms
Eia Ql Hepatitis B Surf Ag,PX-30001244,CDM,87341,CPT,306.0,RC,,,inpatient,,,170.0,127.5,HARVARD PILGRIM [120001],HARVARD PILGRIM SELECT [12000117],,,,,,,,,,CPT,Unknown,Unknown,Unknown,8.204871806906551e-05,,eia ql hepatitis b surf ag
Mgh Cysticercosis Ab 86682,PX-30002220,CDM,86682,CPT,302.0,RC,,,inpatient,,,155.0,116.25,INTERNATIONAL COMMERCIAL [140001],AETNA INTERNATIONAL [14000102],,,77.5,,120.13,,,percent of total billed charges,,CPT,Unknown,Unknown,Unknown,7.48085574425302e-05,,mgh cysticercosis ab 86682
NAIL FEMORAL GT  LEFT D12XL400,SUP-590463,CDM,C1713,HCPCS,278.0,RC,,,outpatient,,,8058.95,6044.21,WELLSENSE [1003],WELLSENSE SIGNATURE ALLIANCE ACO [100308],,,,,8058.95,,,other,APC grouping requires price history; No contract line matched,HCPCS,Unknown,Unknown,Unknown,0.003889864787458199,,nail femoral gt left d12xl400
COUNTERSINK SURGICAL 3MM CANNULATED,SUP-182392,CDM,C1713,HCPCS,278.0,RC,,,inpatient,,,940.8,705.6,BLUE CROSS BLUE SHIELD [110001],BLUE CROSS OUT OF STATE HMO MEDICARE REPLACEMENT [11000120],,,,,,,,,,HCPCS,Unknown,Unknown,Unknown,0.0004540964387979601,,countersink surgical 3mm cannulated
Mgh Neuron Specific Enolase,PX-30002065,CDM,83520,CPT,301.0,RC,,,inpatient,,,213.0,159.75,CENTERS OF EXCELLENCE [1026],MGBHP TRANSPLANT [102609],,,,,,,,,,CPT,Unknown,Unknown,Unknown,0.00010280384519846674,,mgh neuron specific enolase
Mgh Sanger Seq Hdt Array Del/Dup,PX-31000355,CDM,81479,CPT,310.0,RC,,,inpatient,,,73.0,54.75,HUMANA [1012],HUMANA PPO MEDICARE REPLACEMENT [101204],,,,,,,,,,CPT,Unknown,Unknown,Unknown,3.522901268413716e-05,,mgh sanger seq hdt array deldup
VALACYCLOVIR ORAL SUSPENSION 50 MG/ML CMPD MGH_SRH,RX-701177,CDM,25009999,HCPCS,259.0,RC,00000-0022-80,NDC,outpatient,5.0,ML,0.91,,UNITED HEALTHCARE [1016],UNITED VA COMMUNITY CARE NETWORK [101619],,,,,0.91,,,other,APC grouping requires price history; No contract line matched,HCPCS,Unknown,Unknown,Unknown,,,valacyclovir oral suspension 50 mgml cmpd mghsrh
REPLACEMENT RING SIZE 22 FEMORAL REGENEREX PLUS LIMITED HOLE ONE APICAL PLUG ACETABULAR SYSTEM,SUP-416518,CDM,C1776,HCPCS,278.0,RC,,,inpatient,,,411.6,308.7,BLUE CROSS BLUE SHIELD [110001],BLUE CROSS MA HMO POS [11000103],,,,,,,,,,HCPCS,Unknown,Unknown,Unknown,0.00019866357189379425,,replacement ring size 22 femoral regenerex plus limited hole one apical plug acetabular system
BASKET RETRIEVAL 1.3CM 5MM STONE EXTRACTION WIRE MINI,SUP-74262,CDM,C2617,HCPCS,278.0,RC,,,inpatient,,,963.0,722.25,WELLPOINT [1015],WELLPOINT GIC PLUS PPO [101506],,,,,,,,,,HCPCS,Unknown,Unknown,Unknown,0.00046481187652523237,,basket retrieval 13cm 5mm stone extraction wire mini
Hysteroscopy Cannulat Bi Fallopian,PX-76001398,CDM,58565,CPT,761.0,RC,,,inpatient,,,12053.0,9039.75,HARVARD PILGRIM [120001],HARVARD PILGRIM HEALTH PLANS INC HMO [12000114],,3713.25,,,12053.0,3713.25,3713.25,other,Multiple Surgery,CPT,Unknown,Unknown,Unknown,0.00581770396641034,,hysteroscopy cannulat bi fallopian
Removal of Anal Fissure,PX-75000455,CDM,46200,CPT,750.0,RC,,,outpatient,,,3651.0,2738.25,MEDICARE [2001],MEDICARE CLINICAL TRIAL RESTRICTED USE [200106],,,,,3651.0,2101.12,4191.77,other,APC grouping requires price history; No contract line matched,CPT,Unknown,Unknown,Unknown,0.0017622486608003603,,removal anal fissure
HINGE ROTATING 80X66MM XL COMPONENT FEMORAL KNEE MODULAR LEFT,SUP-175749,CDM,C1776,HCPCS,278.0,RC,,,outpatient,,,8550.0,6412.5,CENTERS OF EXCELLENCE [1026],AETNA TRANSPLANT [102601],,,65.6,,5608.8,,,percent of total billed charges,,HCPCS,Unknown,Unknown,Unknown,0.004126885121426793,,hinge rotating 80x66mm xl component femoral knee modular left
Immunofluorescence per Spec 1st Singl Antb Stain,PX-31000038,CDM,88346,CPT,312.0,RC,,,outpatient,,,511.0,383.25,HARVARD PILGRIM [120001],HPHC HPI BMC TIERED HMO [12000123],,658.13,,,511.0,135.42,1085.91,fee schedule,,CPT,Unknown,Unknown,Unknown,0.00024664170297896825,,immunofluorescence per spec 1st singl antb stain
Mgh Tu Cortisone,PX-30002108,CDM,83789,CPT,301.0,RC,,,inpatient,,,288.0,216.0,WELLPOINT [1015],WELLPOINT GIC DENTAL [101503],,,,,,,,,,CPT,Unknown,Unknown,Unknown,0.0001390046483311433,,mgh tu cortisone
METHIMAZOLE 5 MG TABLET,RX-10553,CDM,25009999,HCPCS,250.0,RC,23155-0070-01,NDC,outpatient,1.0,UN,0.59,0.44,WELLPOINT [1015],WELLPOINT GIC COMMUNITY CHOICE [101504],,,74.45,,0.44,,,percent of total billed charges,,HCPCS,Unknown,Unknown,Unknown,2.767350283920164e-07,,methimazole 5 mg tablet
Pf Biopsy Tongue Anterior 2/3,PX-98300324,CDM,41100,CPT,983.0,RC,,,outpatient,,,479.0,359.25,CIGNA [1006],CIGNA MVP MEDICARE REPLACEMENT [100610],,117.9,,,117.9,117.9,1756.21,fee schedule,,CPT,Unknown,Unknown,Unknown,0.00023119602697569295,,pf biopsy tongue anterior 23
NUT BONE LG SPINDLE,SUP-85559,CDM,,,270.0,RC,,,outpatient,,,386.79,290.09,WELLSENSE [1003],WELLSENSE BOSTON CHILDREN'S ACO [100317],,,,,386.79,,,other,APC grouping requires price history; No contract line matched,CDM,Unknown,Unknown,Unknown,0.00018668673729292117,,nut bone lg spindle
NAIL FEMORAL 12X360MM 5DEG BEND RETROGRADE,SUP-665530,CDM,C1713,HCPCS,278.0,RC,,,inpatient,,,3876.45,2907.34,CIGNA [1006],CIGNA MVP MEDICARE REPLACEMENT [100610],,,,,,,,,,HCPCS,Unknown,Unknown,Unknown,0.00187106988394177,,nail femoral 12x360mm 5deg bend retrograde
TRAY 75MM TIBIAL KNEE VANGUARD 360 REVISION SYSTEM,SUP-409143,CDM,C1776,HCPCS,278.0,RC,,,inpatient,,,4086.6,3064.95,ELDER SERVICES [1037],SERENITY CARE PACE [103606],,,,,,,,,,HCPCS,Unknown,Unknown,Unknown,0.001972502925394946,,tray 75mm tibial knee vanguard 360 revision system
Carotene,PX-30000350,CDM,82380,CPT,301.0,RC,,,outpatient,,,105.0,78.75,BLUE CROSS BLUE SHIELD [110001],BLUE CROSS MA PPO EPO [11000113],,28.41,,,28.41,9.04,69.21,fee schedule,,CPT,Unknown,Unknown,Unknown,5.0674688687412494e-05,,carotene
Psycl/Nrpsycl Tst Elec Platform Auto Result,PX-90000143,CDM,96146,CPT,918.0,RC,,,outpatient,,,14.0,10.5,INTERNATIONAL COMMERCIAL [140001],SEGUROS RESERVAS [14000123],,,72.0,,10.08,2.64,247.48,percent of total billed charges,,CPT,Unknown,Unknown,Unknown,6.75104755309826e-06,,psyclnrpsycl tst elec platform auto result
Njx Dx/Ther Sbst Cont Inf/Bolus Intrlmnr Lmbr/Sac W/Img Gdn,PX-76002396,CDM,62327,CPT,761.0,RC,,,inpatient,,,2306.0,1729.5,TRICARE [160005],TRICARE EAST REGION PRIME [16000501],,,,,,,,,,CPT,Unknown,Unknown,Unknown,0.001113047591287694,,njx dxther sbst cont infbolus intrlmnr lmbrsac wimg gdn
Shoulder Disarticulation Cap Only T1,PX-27000548,CDM,L6320,HCPCS,274.0,RC,,,outpatient,,,1436.0,1077.0,GENERIC MEDICARE REPLACEMENT [1010],WELLSENSE NH MEDICARE REPLACEMENT [101004],,2012.27,,,1436.0,1972.02,5193.92,fee schedule,,HCPCS,Unknown,Unknown,Unknown,0.0006931182749486459,,shoulder disarticulation cap t1
CONDYLAR PLATE 4.5X458MM 22 HOLE LCP STAINLESS CURVED STEEL LEFT,SUP-178987,CDM,C1713,HCPCS,278.0,RC,,,inpatient,,,4478.85,3359.14,GENERIC COMMERCIAL [1009],GENERIC SNF [100923],,,,,,,,,,HCPCS,Unknown,Unknown,Unknown,0.002161834734703428,,condylar plate 45x458mm 22 hole lcp stainless curved steel left
GLUCOSE (TOLERANCE TEST) 75 GRAM/296 ML ORAL LIQUID,RX-700955,CDM,25009999,HCPCS,250.0,RC,00000-0015-28,NDC,inpatient,296.0,ML,6.29,4.72,HARVARD PILGRIM [120001],HPHC EXPLORER POS [12000110],,,,,,,,,,HCPCS,Unknown,Unknown,Unknown,3.031213915642784e-06,,glucose tolerance test 75 gram296 ml oral liquid
Cytopath Smear Any Other Source,PX-31000085,CDM,88160,CPT,311.0,RC,,,outpatient,,,230.0,172.5,INTERNATIONAL COMMERCIAL [140001],CIGNA INTERNATIONAL [14000101],,,75.4,,173.42,30.43,79.88,percent of total billed charges,,CPT,Unknown,Unknown,Unknown,0.00011100936057520676,,cytopath smear source
R&B Nursery Level IV Intensive,PX-17400001,CDM,17400001,LOCAL,174.0,RC,,,outpatient,,,14254.0,10690.5,BLUE CROSS BLUE SHIELD [110001],BLUE CROSS FEDERAL [11000102],,,,,,,,,,LOCAL,Unknown,Unknown,Unknown,0.006880076869010622,,rb nursery level iv intensive
IDC-MIFAMURTIDE <MEPACT> (17-175) INJECTION 4 MG,RX-909056,CDM,C9399,HCPCS,636.0,RC,11111-0090-02,NDC,outpatient,50.0,ML,1991.1,1493.32,BLUE CROSS BLUE SHIELD [110001],BLUE CROSS ANTHEM MAINE HMO POS [11000121],,,67.23,,1338.62,,,percent of total billed charges,,HCPCS,Unknown,Unknown,Unknown,0.0009610492680187953,,idcmifamurtide mepact 17175 injection 4 mg
Dermatrix 25 Sq Cm T1,PX-27000635,CDM,Q4128,HCPCS,636.0,RC,,,inpatient,,,4110.75,3083.06,UNITED HEALTHCARE [1016],UNITED SCO ERICKSON MEDICARE REPLACEMENT [101630],,,,,,,,,,HCPCS,Unknown,Unknown,Unknown,0.001984157975079084,,dermatrix 25 sq cm t1
Ephys Eval W/ Ablation Ventricular|DISCONTINUED OUT-PATIENT HOSPITAL/AMBULATORY SURGERY CENTER (ASC) PROCEDURE PRIOR TO THE ADMINISTRATION OF ANESTHESIA,PX-48000248,CDM,93654,CPT,481.0,RC,,,outpatient,,,49971.0,37478.25,TRICARE [160005],TRICARE EAST REGION PRIME [16000501],73,,,Paid using APC or APG reimbursement logic. Includes reimbursement for any outliers.,8045.08,,,other,Tricare OPPS,CPT,Unknown,Unknown,Unknown,0.024119864675541405,,ephys eval w ablation ventriculardiscontinued outpatient hospitalambulatory surgery center asc procedure prior administration anesthesia
HC Add Shoe Special Exten Instep Tier1,PX-27000464,CDM,L3570,HCPCS,274.0,RC,,,outpatient,,,74.0,55.5,CIGNA ALTERNATE [1018],TUFTS CIGNA CARELINK BLENDED [101807],,174.39,,,79.18,149.54,252.62,fee schedule,,HCPCS,Unknown,Unknown,Unknown,3.571169005923951e-05,,hc add shoe special exten instep tier1
EXPANDER TISSUE 850CC W15.5CM H14.5CM P8.1CM STYLE 133S SMOOTH NATRELLE FOURTE MODERATE EXTRA,SUP-601061,CDM,C1889,HCPCS,278.0,RC,,,inpatient,,,3766.0,2824.5,CIGNA [1006],CIGNA CARELINK PPO [100601],,,,,,,,,,HCPCS,Unknown,Unknown,Unknown,0.0018177565589371312,,expander tissue 850cc w155cm h145cm p81cm style 133s smooth natrelle fourte moderate extra
Mgh Ada Gene Sequencing,PX-31000270,CDM,81479,CPT,310.0,RC,,,outpatient,,,4461.0,3345.75,HARVARD PILGRIM [120001],HPHC CONNECTORCARE [12000126],,,40.8,,1820.09,134.8,134.8,percent of total billed charges,,CPT,Unknown,Unknown,Unknown,0.0021532173346332675,,mgh ada gene sequencing
Craniosunostosis Ngs Panel,PX-30003385,CDM,81479,CPT,310.0,RC,,,inpatient,,,95.0,71.25,COMMONWEALTH CARE ALLIANCE [1007],COMMONWEALTH CARE ALLIANCE PREF VALUE MEDICARE REPLACEMENT [100703],,,,,,,,,,CPT,Unknown,Unknown,Unknown,4.584791493638895e-05,,craniosunostosis ngs panel
Morphometric Analysis Nerve,PX-31000045,CDM,88356,CPT,312.0,RC,,,inpatient,,,833.0,624.75,CIGNA [1006],CIGNA CARELINK PPO [100601],,,,,,,,,,CPT,Unknown,Unknown,Unknown,0.0004020638177619263,,morphometric analysis nerve
STENT VASCULAR 7X20MM 0.014IN ACCULINK NICKEL TITANIUM RAPID EXCHANGE SELF EXPANDING STRAIGHT CAROTID,SUP-87987,CDM,C1876,HCPCS,278.0,RC,,,inpatient,,,4725.0,3543.75,TUFTS HEALTH PLAN [170001],TUFTS NAVIGATOR PPO [17000112],,,,,,,,,,HCPCS,Unknown,Unknown,Unknown,0.002280644161660289,,stent vascular 7x20mm 0014in acculink nickel titanium rapid exchange self expanding straight carotid
Njx Drg C-Cathj Slctv P-Art Angiography Bi,PX-48000485,CDM,93573,CPT,481.0,RC,,,outpatient,,,1691.0,1268.25,MARTIN'S POINT [160007],MARTIN'S POINT GENERATIONS ADV HMO MEDICARE REPLACEMENT [16000702],,64.63,,,64.63,64.63,64.63,fee schedule,,CPT,Unknown,Unknown,Unknown,0.0008162010055997462,,njx drg ccathj slctv part angiography bi
CT Thoracic Spine W/Contrast,PX-35000038,CDM,72129,CPT,352.0,RC,,,outpatient,,,2684.0,2013.0,TUFTS HEALTH PLAN [170001],TUFTS SENIOR CARE OPTION MEDICARE REPLACEMENT [17000111],,,,Paid using APC or APG reimbursement logic. Includes reimbursement for any outliers.,196.52,137.38,1175.09,other,OPPS APC,CPT,Unknown,Unknown,Unknown,0.001295499639076384,,ct thoracic spine wcontrast
OLANZAPINE 5 MG TABLET,RX-17936,CDM,25009999,HCPCS,259.0,RC,60505-3111-00,NDC,outpatient,1.0,UN,0.91,,GENERIC MEDICARE REPLACEMENT [1010],NEIGHBORHOOD HEALTH PLAN RI SCO MEDICARE REPLACEMENT [101008],,,,,0.91,,,other,APC grouping requires price history; No contract line matched,HCPCS,Unknown,Unknown,Unknown,,,olanzapine 5 mg tablet
AMOXICILLIN 250 MG CAPSULE,RX-450,CDM,25009999,HCPCS,259.0,RC,65862-0016-01,NDC,inpatient,1.0,UN,0.2,,UNITED HEALTHCARE [1016],UNITED VA COMMUNITY CARE NETWORK [101619],,,,,,,,,,HCPCS,Unknown,Unknown,Unknown,,,amoxicillin 250 mg capsule
Ostectomy Calcaneus,PX-36000494,CDM,28118,CPT,361.0,RC,,,outpatient,,,6444.0,4833.0,CENTERS OF EXCELLENCE [1026],OPTUM HEALTH TRANSPLANT [102604],,,70.0,,4510.8,2361.01,7440.77,percent of total billed charges,,CPT,Unknown,Unknown,Unknown,0.003110366569461236,,ostectomy calcaneus
