description,code|1,code|1|type,code|2,code|2|type,code|3,code|3|type,code|4,code|4|type,setting,drug_unit_of_measurement,drug_type_of_measurement,standard_charge|gross,standard_charge|discounted_cash,payer_name,plan_name,modifiers,standard_charge|negotiated_dollar,standard_charge|negotiated_percentage,standard_charge|negotiated_algorithm,estimated_amount,standard_charge|min,standard_charge|max,standard_charge|methodology,additional_generic_notes,service|type,code|1|description,code|2|description,clinical_domain,pricing|discounted,pricing|gross,description_clean
GUIDEWIRE .008IN DOUBLE ANGLE TIP HYBRID,SUP-666379,CDM,C1769,HCPCS,272.0,RC,,,inpatient,,,2047.5,1535.62,TUFTS HEALTH PLAN [170001],TUFTS SENIOR CARE OPTION MEDICARE REPLACEMENT [17000111],,,,,,,,,,HCPCS,Unknown,Unknown,Unknown,0.000988272271974568,,guidewire 008in double angle tip hybrid
Xr Urogram W/Nephrotomogram,PX-32000226,CDM,74415,CPT,320.0,RC,,,outpatient,,,2113.0,1584.75,HARVARD PILGRIM [120001],HARVARD PILGRIM HEALTH PLANS INC UMR [12000116],,359.1,,,359.1,342.96,1087.8,fee schedule,,CPT,Unknown,Unknown,Unknown,0.0010198908578929397,,xr urogram wnephrotomogram
Factor VIII Recomb Obizur,PX-63601231,CDM,J7188,HCPCS,636.0,RC,,,inpatient,,,19.38,14.53,UNITED HEALTHCARE [1016],UNITED PPO AARP MEDICARE REPLACEMENT [101612],,,,,,,,,,HCPCS,Unknown,Unknown,Unknown,9.344633981981576e-06,,factor viii recomb obizur
KNEE IMPLANT 3.5CM AUGMENTED FEMORAL RESURFACE THICK ANTERIOR ONC 09,SUP-416646,CDM,C1776,HCPCS,278.0,RC,,,inpatient,,,5085.0,3813.75,MEDICARE [2001],MEDICARE RAILROAD [200105],,,,,,,,,,HCPCS,Unknown,Unknown,Unknown,0.0024544080166971367,,knee implant 35cm augmented femoral resurface thick anterior onc 09
CRANIOFACIAL PLATE 1.0MM 16 HOLE MICRO TITANIUM STRAIGHT,SUP-487086,CDM,C1713,HCPCS,278.0,RC,,,inpatient,,,897.51,673.13,MEDICARE [2001],MEDICARE PART A & B [200103],,,,,,,,,,HCPCS,Unknown,Unknown,Unknown,0.0004331997263051955,,craniofacial plate 10mm 16 hole micro titanium straight
CATHETER SUPERTORQUE PLUS 5.2FR 100CM .038IN VASCULAR JUDKINS RIGHT 4 BX/5EA --ORDER IN MULT OF 5--,SUP-430294,CDM,C1725,HCPCS,272.0,RC,,,inpatient,,,25.38,19.03,CENTERS OF EXCELLENCE [1026],OPTUM HEALTH TRANSPLANT [102604],,,,,,,,,,HCPCS,Unknown,Unknown,Unknown,1.2240698232595702e-05,,catheter supertorque plus 52fr 100cm 038in vascular judkins right 4 bx5ea order mult 5
CLIP ANEURYSM 5MMX4 110G YASARGIL PHYNOX PERMANENT MINI STRAIGHT TITANIUM FT690T,SUP-48510,CDM,,,278.0,RC,,,inpatient,,,1333.5,1000.12,MEDICAID NON MASSACHUSETTS [3002],FLORIDA MEDICAID [300202],,,,,,,,,,CDM,Unknown,Unknown,Unknown,0.0006436406261514872,,clip aneurysm 5mmx4 110g yasargil phynox permanent mini straight titanium ft690t
CATHETER SUPREME 5FR 10MM DIAGNOSTIC COURNAND CURVE QUADRIPOLAR,SUP-3945,CDM,C1730,HCPCS,272.0,RC,,,inpatient,,,366.21,274.66,MEDICAID NON MASSACHUSETTS [3002],NEW YORK MEDICAID [300206],,,,,,,,,,HCPCS,Unknown,Unknown,Unknown,0.0001767564547624821,,catheter supreme 5fr 10mm diagnostic cournand curve quadripolar
Photochemotherapy Uvb,PX-76001685,CDM,96910,CPT,761.0,RC,,,inpatient,,,332.0,249.0,MEDICARE [2001],MEDICARE PART A & B [200103],,,,,,124.66,131.37,,,CPT,Unknown,Unknown,Unknown,0.00016024245283564688,,photochemotherapy uvb
Debridement Mastoidectomy Cavity Simple,PX-36000114,CDM,69220,CPT,361.0,RC,,,inpatient,,,420.0,315.0,SENIOR WHOLE HEALTH [1014],SENIOR WHOLE HEALTH SCO MEDICARE REPLACEMENT [101401],,,,,,,,,,CPT,Unknown,Unknown,Unknown,0.00020271806184465405,,debridement mastoidectomy cavity simple
VENETOCLAX 100 MG TABLET,RX-189313,CDM,25009999,HCPCS,250.0,RC,00074-0576-11,NDC,outpatient,1.0,UN,546.04,409.53,MGB HEALTH PLAN [150001],MGBHP EMPLOYEES FAMILY [15000110],,,38.0,,207.5,,,percent of total billed charges,,HCPCS,Unknown,Unknown,Unknown,0.00026355471820255476,,venetoclax 100 mg tablet
GUIDEWIRE ENDOSCOPIC 3MM 150CM 0.038IN WIREX J TIP MOVEABLE CORE HYDROPHILIC RADIOPAQUE S/S,SUP-285636,CDM,C1769,HCPCS,272.0,RC,,,inpatient,,,61.22,45.91,HARVARD PILGRIM [120001],HARVARD PILGRIM INDEPENDENCE GIC PPO [12000108],,,,,,,,,,HCPCS,Unknown,Unknown,Unknown,2.9539855356264075e-05,,guidewire endoscopic 3mm 150cm 0038in wirex j tip moveable core hydrophilic radiopaque ss
Glucagon Tolerance,PX-30000462,CDM,82946,CPT,301.0,RC,,,inpatient,,,254.0,190.5,TUFTS HEALTH PLAN [170001],TUFTS SPIRIT OR SELECT [17000107],,,,,,63.44,66.64,,,CPT,Unknown,Unknown,Unknown,0.00012259361757766324,,glucagon tolerance
MENTHOL 5.4 MG LOZENGES,RX-169044,CDM,25009999,HCPCS,250.0,RC,12546-0629-36,NDC,outpatient,1.0,UN,7.4,5.55,HEALTH NEW ENGLAND ALTERNATE [1047],HEALTH NEW ENGLAND MBHP [104701],,,,,7.4,,,other,APC grouping requires price history; No contract line matched,HCPCS,Unknown,Unknown,Unknown,3.565376877422723e-06,,menthol 54 mg lozenges
STENT TRACHEOBRONCHIAL 16MM 25FR 60 5.1 .035IN GUIDEWIRE COVER DISTAL RELEASE AIRWAY ULTRAFLEX ACCEPTS,SUP-480955,CDM,C1874,HCPCS,278.0,RC,,,inpatient,,,7725.0,5793.75,CIGNA [1006],CIGNA HMO MEDICARE REPLACEMENT [100614],,,,,,,,,,HCPCS,Unknown,Unknown,Unknown,0.0037286762869673516,,stent tracheobronchial 16mm 25fr 60 51 035in guidewire cover distal release airway ultraflex accepts
DURVALUMAB 50 MG/ML INTRAVENOUS SOLUTION,RX-193368,CDM,J9173,HCPCS,636.0,RC,00310-4611-50,NDC,inpatient,10.0,ML,17543.58,13157.68,INTERNATIONAL COMMERCIAL [140001],AETNA INTERNATIONAL [14000102],,,77.5,,13596.27,,,percent of total billed charges,,HCPCS,Unknown,Unknown,Unknown,0.008467879490750656,,durvalumab 50 mgml intravenous solution
Uterine And Adnexa Procedures For Non-Malignancy Without Cc/McC,743,MS-DRG,,,,,,,inpatient,,,77643.0,58232.25,CENTERS OF EXCELLENCE [1026],AETNA TRANSPLANT [102601],,,65.6,,50933.81,8003.0,29427.83,percent of total billed charges,,MS-DRG,Unknown,Unknown,Unknown,0.03747651299937375,,uterine adnexa procedures nonmalignancy without ccmcc
SPINE SPACER 8X19 16MM COROENT PEEK CONTOURED,SUP-524460,CDM,C1889,HCPCS,278.0,RC,,,inpatient,,,2450.0,1837.5,MEDICAID NON MASSACHUSETTS [3002],CONNECTICUT MEDICAID [300201],,,,,,,,,,HCPCS,Unknown,Unknown,Unknown,0.001182553133302433,,spine spacer 8x19 16mm coroent peek contoured
Tx Fx Ulna Prox Closed,PX-76000436,CDM,24670,CPT,761.0,RC,,,inpatient,,,1725.0,1293.75,MEDICARE ALTERNATE [2002],MEDICARE NHIC PRO [200201],,,,,,225.09,225.09,,,CPT,Unknown,Unknown,Unknown,0.0008326120363532262,,tx fx ulna prox closed
DEXTROMETHORPHAN-GUAIFENESIN 10 MG-100 MG/5 ML ORAL SYRUP,RX-9774,CDM,25009999,HCPCS,259.0,RC,00121-0638-00,NDC,outpatient,5.0,ML,7.46,,GENERIC MEDICARE REPLACEMENT [1010],MASS ADVANTAGE UMASS MEM MEDICARE REPLACEMENT [101005],,,,,7.46,,,other,APC grouping requires price history; No contract line matched,HCPCS,Unknown,Unknown,Unknown,,,dextromethorphanguaifenesin 10 mg100 mg5 ml oral syrup
Atxn10 Gene Analysis Eval Detc Abnormal Alleles,PX-31000959,CDM,81183,CPT,310.0,RC,,,inpatient,,,1579.0,1184.25,HARVARD PILGRIM [120001],HARVARD PILGRIM SELECT [12000117],,,,,,489.09,513.75,,,CPT,Unknown,Unknown,Unknown,0.0007621411395882825,,atxn10 gene analysis eval detc abnormal alleles
Colsc Flexible W/Control Bleeding Any Method,PX-75000197,CDM,45382,CPT,750.0,RC,,,inpatient,,,2623.0,1967.25,BLUE CROSS BLUE SHIELD [110001],BLUE CROSS ANTHEM PATHWAY HMO POS [11000116],,,,,,,,,,CPT,Unknown,Unknown,Unknown,0.0012660563191951404,,colsc flexible wcontrol bleeding method
SET CATHETER SUPRAPUBIC 12FRX30CM DRAINAGE UNIVERSAL MALECOT,SUP-634602,CDM,C1729,HCPCS,272.0,RC,,,inpatient,,,180.64,135.48,HARVARD PILGRIM [120001],HARVARD PILGRIM BILH DOMESTIC COMMUNITY HMO [12000119],,,,,,,,,,HCPCS,Unknown,Unknown,Unknown,8.718440534015456e-05,,set catheter suprapubic 12frx30cm drainage universal malecot
SCREW BONE 4X34MM SM SOLID LAG HALLUX IMPLANTABLE INTRAMEDULLARY FUSION DEVICE,SUP-360378,CDM,C1713,HCPCS,278.0,RC,,,inpatient,,,2520.0,1890.0,TUFTS HEALTH PUBLIC PLANS [1013],TUFTS PUBLIC PLANS ONE CARE MEDICARE REPLACEMENT [101304],,,,,,,,,,HCPCS,Unknown,Unknown,Unknown,0.001216340549559598,,screw bone 4x34mm sm solid lag hallux implantable intramedullary fusion device
Mgh Ritonavir,PX-30001528,CDM,80299,CPT,301.0,RC,,,outpatient,,,315.0,236.25,CIGNA ALTERNATE [1018],TUFTS CIGNA CARELINK NON CONFORMING [101805],,102.84,,,102.84,18.27,102.84,fee schedule,,CPT,Unknown,Unknown,Unknown,0.00015203693745890687,,mgh ritonavir
CHOLECALCIFEROL (VITAMIN D3) 10 MCG/ML (400 UNIT/ML) ORAL DROPS,RX-96930,CDM,25009999,HCPCS,250.0,RC,,,outpatient,1.0,ML,0.64,0.48,MASSHEALTH [3001],MASSHEALTH MASS GENERAL BRIGHAM ACO [300116],,,,,0.64,,,other,APC grouping requires price history; No contract line matched,HCPCS,Unknown,Unknown,Unknown,3.024778217308086e-07,,cholecalciferol vitamin d3 10 mcgml 400 unitml oral drops
Colposcopy Entire Vagina,PX-76001360,CDM,57420,CPT,761.0,RC,,,outpatient,,,652.0,489.0,HARVARD PILGRIM [120001],HARVARD PILGRIM HEALTH PLANS INC UMR [12000116],,273.0,,,641.55,94.73,909.14,other,Multiple Surgery,CPT,Unknown,Unknown,Unknown,0.0003146992128684002,,colposcopy entire vagina
PEG BONE 16X2.0MM LOCKING SMOOTH GEMINUS TITANIUM IMPLANTABLE FOSSA SPECIFIC PLATING SYSTEM FIXATION,SUP-431606,CDM,C1713,HCPCS,278.0,RC,,,outpatient,,,378.0,283.5,GENERIC MEDICARE REPLACEMENT [1010],MASS ADVANTAGE UMASS MEM MEDICARE REPLACEMENT [101005],,,,,378.0,,,other,APC grouping requires price history; No contract line matched,HCPCS,Unknown,Unknown,Unknown,0.00018244561209035517,,peg bone 16x20mm locking smooth geminus titanium implantable fossa specific plating system fixation
Exc Lesn Mal Face/Ear/Lip 0.6-1.0cm,PX-76000081,CDM,11641,CPT,761.0,RC,,,inpatient,,,913.0,684.75,HARVARD PILGRIM [120001],HPHC ACCESS AMERICA [12000125],,579.34,,,913.0,579.34,579.34,other,Multiple Surgery,CPT,Unknown,Unknown,Unknown,0.00044067800777011464,,exc lesn mal faceearlip 0610cm
AMPICILLIN 1 GRAM SOLUTION FOR INJECTION,RX-469,CDM,J0290,HCPCS,636.0,RC,55150-0113-10,NDC,inpatient,4.0,ML,5.5,4.12,HARVARD PILGRIM [120001],HPHC HPI BMC TIERED HMO [12000123],,,,,,,,,,HCPCS,Unknown,Unknown,Unknown,2.645072015560901e-06,,ampicillin 1 gram solution injection
Sleep Study Attended,PX-74000008,CDM,95807,CPT,740.0,RC,,,outpatient,,,4317.0,3237.75,HARVARD PILGRIM [120001],HARVARD PILGRIM STUDENT RESOURCES [12000106],,837.7,,,837.7,736.17,4104.37,fee schedule,,CPT,Unknown,Unknown,Unknown,0.0020837117926185283,,sleep study attended
K-WIRE BONE 2.0X152MM SS,SUP-133517,CDM,C1713,HCPCS,278.0,RC,,,inpatient,,,131.6,98.7,BLUE CROSS BLUE SHIELD [110001],BLUE CROSS RI MEDICARE REPLACEMENT [11000128],,,,,,,,,,HCPCS,Unknown,Unknown,Unknown,6.351390686513511e-05,,kwire bone 20x152mm ss
BONE PLATE 4.5X189MM 10 HOLE LOCKING COMPRESSION LCP RECONSTRUCTION STRAIGHT TITANIUM,SUP-184381,CDM,C1713,HCPCS,278.0,RC,,,inpatient,,,1763.79,1322.84,BLUE CROSS BLUE SHIELD [110001],BLUE CROSS OUT OF STATE POS [11000142],,,,,,,,,,HCPCS,Unknown,Unknown,Unknown,0.0008513334828088628,,bone plate 45x189mm 10 hole locking compression lcp reconstruction straight titanium
Nucleic Acid Amp Chlamydia Trach,PX-30001275,CDM,87491,CPT,306.0,RC,,,inpatient,,,295.0,221.25,CENTERS OF EXCELLENCE [1026],CIGNA TRANSPLANT [102602],,,,,,,,,,CPT,Unknown,Unknown,Unknown,0.00014238338995685977,,nucleic acid amp chlamydia trach
SHOULDER BASEPLATE SMALL UNIVERSAL TITANIUM,SUP-424971,CDM,C1713,HCPCS,278.0,RC,,,inpatient,,,3934.14,2950.6,VETERANS ADMINISTRATION [160006],VETERANS ADMINISTRATION OF RI [16000602],,,,,,,,,,HCPCS,Unknown,Unknown,Unknown,0.0018989107149376735,,shoulder baseplate small universal titanium
LEUPROLIDE 11.25 MG (3 MONTH) INTRAMUSCULAR SYRINGE KIT,RX-21044,CDM,J1950,HCPCS,636.0,RC,00074-3663-03,NDC,outpatient,11.25,ME,13416.4,10062.3,HARVARD PILGRIM [120001],HARVARD PILGRIM INDEPENDENCE GIC PPO [12000108],,5758.08,,,5758.08,5300.49,11216.82,fee schedule,,HCPCS,Unknown,Unknown,Unknown,0.00647578629962489,,leuprolide 1125 mg 3 month intramuscular syringe kit
Culture Typing Chromatography,PX-30001169,CDM,87143,CPT,306.0,RC,,,inpatient,,,202.0,151.5,MEDICARE ALTERNATE [2002],MEDICARE NHIC PRO [200201],,,,,,,,,,CPT,Unknown,Unknown,Unknown,9.749439407234085e-05,,culture typing chromatography
KIT TUBE 16FR 45CM FEEDING TRANSGASTRIC-JEJUNAL MIC-KEY SILICONE LOW PROFILE SECUR-LOK 7-10ML BALLOON 2CM STOMA,SUP-103717,CDM,,,272.0,RC,,,outpatient,,,1218.0,913.5,UNITED HEALTHCARE [1016],UNITED SCO ERICKSON MEDICARE REPLACEMENT [101630],,,,,1218.0,,,other,APC grouping requires price history; No contract line matched,CDM,Unknown,Unknown,Unknown,0.0005878946071763327,,kit tube 16fr 45cm feeding transgastricjejunal mickey silicone low profile securlok 710ml balloon 2cm stoma
Biopsy Tissue Thigh/Knee Deep,PX-76000564,CDM,27324,CPT,761.0,RC,,,outpatient,,,5866.0,4399.5,TUFTS HEALTH PLAN [170001],TUFTS UNIFORMED SERVICES FAMILY HEALTH PLAN [17000110],,,,Paid using APC or APG reimbursement logic. Includes reimbursement for any outliers.,2946.21,454.81,2719.71,other,Tricare OPPS,CPT,Unknown,Unknown,Unknown,0.002831379046652075,,biopsy tissue thighknee deep
FLUDARABINE 50 MG INTRAVENOUS SOLUTION,RX-10053,CDM,J9185,HCPCS,636.0,RC,45963-0609-55,NDC,inpatient,2.0,ML,367.8,275.85,MEDICAID NON MASSACHUSETTS [3002],NH MEDICAID [300205],,,,,,,,,,HCPCS,Unknown,Unknown,Unknown,0.00017752230286431116,,fludarabine 50 mg intravenous solution
"CABOTEGRAVIR ER 600 MG/3 ML (200 MG/ML) IM SUSPENSION,EXTENDED RELEASE",RX-209833,CDM,J0739,HCPCS,636.0,RC,49702-0264-23,NDC,outpatient,3.0,ML,16689.97,12517.48,HARVARD PILGRIM [120001],HARVARD PILGRIM FOCUS [12000111],,,40.8,,6809.51,9984.0,9984.0,percent of total billed charges,,HCPCS,Unknown,Unknown,Unknown,0.008055866083363287,,cabotegravir er 600 mg3 ml 200 mgml im suspensionextended release
Real-Time Rt-Pcr Panel for Detection 2019-Novel Coronavirus,PX-30003639,CDM,U0001,HCPCS,300.0,RC,,,inpatient,,,0.01,0.01,MGB HEALTH PLAN [150001],MGBHP HMO [15000102],,,,,,,,,,HCPCS,Unknown,Unknown,Unknown,0.0,,realtime rtpcr panel detection 2019novel coronavirus
MOSUNETUZUMAB-AXGB 1 MG/ML INTRAVENOUS SOLUTION,RX-213430,CDM,J9350,HCPCS,636.0,RC,50242-0159-01,NDC,outpatient,1.0,ML,2601.04,1950.78,MASSHEALTH [3001],MASSHEALTH PENDING [300107],,,,,2601.04,595.9,1544.55,other,APC grouping requires price history; No contract line matched,HCPCS,Unknown,Unknown,Unknown,0.0012554567240378926,,mosunetuzumabaxgb 1 mgml intravenous solution
Extensive O.R. Procedures Unrelated To Principal Diagnosis With Cc,982,MS-DRG,,,,,,,inpatient,,,109286.06,81964.54,AETNA [1001],AETNA HMO MEDICARE REPLACEMENT [100109],,18516.37,,"Wage-adjusted base payment rate plus any adjustments related to capital costs, indirect medical education (IME), disproportionate share hospital (DSH) adjustors, new technology, hemophilia, sole community hospital (SCH) and Medicare Dependent Hospital (MDH) adjustors, transfers, and outliers.",22161.34,13467.79,92781.22,other,Inpatient DRG,MS-DRG,Unknown,Unknown,Unknown,0.052749898922530875,,extensive procedures unrelated principal diagnosis cc
KIT INTRODUCER MIC-KEY 14FR .035IN 18G NEEDLE J-TIP GUIDEWIRE HEMOSTAT ANCHOR SET W/4 SAF-T-PEXY T-FASTENERS DILATOR OTW STOMA MEASURING DEVICE 12ML SYRINGE,SUP-163262,CDM,,,272.0,RC,,,inpatient,,,769.9,577.42,UNITED HEALTHCARE [1016],UNITED SCO ERICKSON MEDICARE REPLACEMENT [101630],,,,,,,,,,CDM,Unknown,Unknown,Unknown,0.0003716036575438004,,kit introducer mickey 14fr 035in 18g needle jtip guidewire hemostat anchor set w4 saftpexy tfasteners dilator otw stoma measuring device 12ml syringe
Morphometric Analysis Skeletal,PX-31000044,CDM,88355,CPT,312.0,RC,,,outpatient,,,500.0,375.0,INTERNATIONAL COMMERCIAL [140001],BERMUDA GEHI [14000105],,,78.0,,390.0,144.36,573.13,percent of total billed charges,,CPT,Unknown,Unknown,Unknown,0.00024133225185284237,,morphometric analysis skeletal
Indwelling Catheter Foley Type 3-Way for Continuous Irrigation Each,PX-27001113,CDM,A4346,HCPCS,272.0,RC,,,inpatient,,,43.93,32.95,HARVARD PILGRIM [120001],HPHC ELEVATE HMO [12000118],,,,,,,,,,HCPCS,Unknown,Unknown,Unknown,2.11991903144954e-05,,indwelling catheter foley type 3way continuous irrigation
Revsc Fem/Pop Artery W/Stent,PX-76001154,CDM,37226,CPT,361.0,RC,,,outpatient,,,13805.0,10353.75,TRICARE [160005],TRICARE SOUTH REGION [16000502],,,,Paid using APC or APG reimbursement logic. Includes reimbursement for any outliers.,10491.8,516.36,31796.12,other,Tricare OPPS,CPT,Unknown,Unknown,Unknown,0.0066633547275896645,,revsc fempop artery wstent
GRAFT BONE 29X9MM 5DEG FROZEN THORACOLUMBAR INTERBODY FUSION LORDOTIC VERTI2 IMPLANTABLE,SUP-124265,CDM,C1889,HCPCS,278.0,RC,,,outpatient,,,8344.03,6258.02,INTERNATIONAL COMMERCIAL [140001],UNITED INTERNATIONAL OTHER [14000121],,,77.01,,6425.74,,,percent of total billed charges,,HCPCS,Unknown,Unknown,Unknown,0.004027466453552378,,graft bone 29x9mm 5deg frozen thoracolumbar interbody fusion lordotic verti2 implantable
PHENOL (BULK) 89 % LIQUID,RX-41319,CDM,25009999,HCPCS,250.0,RC,38779-1938-05,NDC,inpatient,100.0,ML,53.55,40.16,UNITED HEALTHCARE ALTERNATE [1020],UNITED HARVARD PILGRIM PREFERRED A [102002],,,,,,,,,,HCPCS,Unknown,Unknown,Unknown,2.5839328813812693e-05,,phenol bulk 89 liquid
PEG BONE 2.3X40MM TITANIUM THREADED LOCKING,SUP-498549,CDM,C1713,HCPCS,278.0,RC,,,inpatient,,,388.5,291.37,GENERIC MEDICARE REPLACEMENT [1010],NEIGHBORHOOD HEALTH PLAN RI SCO MEDICARE REPLACEMENT [101008],,,,,,,,,,HCPCS,Unknown,Unknown,Unknown,0.00018751050667976254,,peg bone 23x40mm titanium threaded locking
SCREW EMERGENCY 1.2MMX7 CENTRE DRIVE MICRO TITANIUM ALLOCKINGY TI 6AL4V,SUP-486821,CDM,C1713,HCPCS,278.0,RC,,,inpatient,,,222.43,166.82,FALLON HEALTH [1008],FALLON MEDICARE REPLACEMENT [100803],,,,,,,,,,HCPCS,Unknown,Unknown,Unknown,0.00010735388392109826,,screw emergency 12mmx7 centre drive micro titanium allockingy ti 6al4v
TRAY TIBIAL LONG SIZE 5 INBONE II TITANIUM ALLOY LEFT,SUP-433520,CDM,C1776,HCPCS,278.0,RC,,,inpatient,,,4839.0,3629.25,MEDICAID NON MASSACHUSETTS [3002],FLORIDA MEDICAID [300202],,,,,,,,,,HCPCS,Unknown,Unknown,Unknown,0.0023356693824219572,,tray tibial long size 5 inbone ii titanium alloy left
Observation 1 Hr,PX-76200003,CDM,99221,CPT,762.0,RC,,,inpatient,,,227.0,170.25,VETERANS ADMINISTRATION [160006],VETERANS ADMINISTRATION SPECIAL BILLING [16000605],,,,,,,,,,CPT,Unknown,Unknown,Unknown,0.0001095613284498997,,observation 1 hr
Marsup Cyst Bartholin's Gland,PX-76001332,CDM,56440,CPT,761.0,RC,,,outpatient,,,4645.0,3483.75,BLUE CROSS BLUE SHIELD [110001],BLUE CROSS ANTHEM NH PPO MEDICARE REPLACEMENT [11000124],,,,,4645.0,2125.14,4191.77,other,APC grouping requires price history; No contract line matched,CPT,Unknown,Unknown,Unknown,0.0022420299716521008,,marsup cyst bartholins gland
AZITHROMYCIN 1 GRAM ORAL PACKET,RX-15284,CDM,Q0144,HCPCS,636.0,RC,00069-3051-07,NDC,inpatient,1.0,UN,492.29,369.22,HARVARD PILGRIM [120001],HPHC ELEVATE HMO [12000118],,,,,,,,,,HCPCS,Unknown,Unknown,Unknown,0.0002376124182153869,,azithromycin 1 gram oral packet
CLINDAMYCIN 1 % LOTION,RX-19711,CDM,25009999,HCPCS,250.0,RC,00009-3329-01,NDC,inpatient,60.0,ML,113.99,85.49,TUFTS HEALTH PLAN [170001],TUFTS SELECT [17000116],,,,,,,,,,HCPCS,Unknown,Unknown,Unknown,5.5012349364998975e-05,,clindamycin 1 lotion
G150242 Nupulse Cv Ivas,PX-62400168,CDM,,,624.0,RC,,,inpatient,,,199468.0,149601.0,MEDICARE ALTERNATE [2002],MEDICARE RAILROAD PROF [200202],,,,,,,,,,CDM,Unknown,Unknown,Unknown,0.09627868422121805,,g150242 nupulse cv ivas
"GUANFACINE ER 2 MG TABLET,EXTENDED RELEASE 24 HR",RX-99836,CDM,25009998,HCPCS,250.0,RC,00228-2851-11,NDC,outpatient,1.0,UN,2.89,2.17,UNITED HEALTHCARE [1016],UNITED HMO AARP MEDICARE REPLACEMENT [101607],,,,,2.89,,,other,APC grouping requires price history; No contract line matched,HCPCS,Unknown,Unknown,Unknown,1.39011084029478e-06,,guanfacine er 2 mg tabletextended release 24 hr
Esophagoscopy Rigid Transoral Inj Submucosal,PX-75000393,CDM,43192,CPT,750.0,RC,,,outpatient,,,3420.0,2565.0,CENTERS OF EXCELLENCE [1026],OPTUM HEALTH MEDICAID REPLACEMENT TRANSPLANT [102611],,,,Paid using APC or APG reimbursement logic. Includes reimbursement for any outliers.,2595.98,181.27,4191.77,other,OPPS APC,CPT,Unknown,Unknown,Unknown,0.0016507501871517165,,esophagoscopy rigid transoral inj submucosal
FULVESTRANT 250 MG/5 ML INTRAMUSCULAR SYRINGE,RX-108096,CDM,J9395,HCPCS,636.0,RC,00143-9022-02,NDC,inpatient,5.0,ML,143.29,107.47,HARVARD PILGRIM ALTERNATE [120002],HARVARD PILGRIM UNITED NON PREFERRED B [12000205],,,,,,,,,,HCPCS,Unknown,Unknown,Unknown,6.915801430466531e-05,,fulvestrant 250 mg5 ml intramuscular syringe
Mgh Buproprion Oh Buprop,PX-30001538,CDM,80299,CPT,301.0,RC,,,outpatient,,,135.0,101.25,ELDER SERVICES [1037],SERENITY CARE PACE [103606],,18.64,,,18.64,18.27,102.84,fee schedule,,CPT,Unknown,Unknown,Unknown,6.515500994048311e-05,,mgh buproprion oh buprop
TIBIAL PLATE 3.5X119MM 6 HOLE L LEG LCP SS MEDIAL PROXIMALIMAL RIGHT,SUP-165298,CDM,C1713,HCPCS,278.0,RC,,,inpatient,,,3542.13,2656.6,WELLSENSE [1003],WELLSENSE NSPG PCP CLARITY COMMERCIAL [100314],,,,,,,,,,HCPCS,Unknown,Unknown,Unknown,0.0017097011838975507,,tibial plate 35x119mm 6 hole l leg lcp ss medial proximalimal right
TIOTROPIUM BROMIDE 2.5 MCG/ACTUATION MIST FOR INHALATION,RX-179427,CDM,25009999,HCPCS,250.0,RC,00597-0100-61,NDC,inpatient,4.0,GR,1865.8,1399.35,BLUE CROSS BLUE SHIELD [110001],BLUE CROSS OUT OF STATE MEDICAID [11000125],,,,,,,,,,HCPCS,Unknown,Unknown,Unknown,0.0009005730107676376,,tiotropium bromide 25 mcgactuation mist inhalation
Xr Hand 2v|REPEAT PROCEDURE BY ANOTHER PHYSICIAN,PX-32000125,CDM,73120,CPT,320.0,RC,,,inpatient,,,415.0,311.25,HARVARD PILGRIM [120001],HARVARD PILGRIM BILH DOMESTIC COMMUNITY HMO [12000119],77,293.65,,,293.65,293.65,308.28,fee schedule,,CPT,Unknown,Unknown,Unknown,0.00020030467496914226,,xr hand 2vrepeat procedure another physician
SHOULDER BASEPLATE 25MM COBALT ALLOY COMPREHENSIVE REVERSE TAPER ADAPTER MINI,SUP-417361,CDM,C1776,HCPCS,278.0,RC,,,inpatient,,,4725.0,3543.75,BLUE CROSS BLUE SHIELD [110001],BLUE CROSS RI HMO POS [11000126],,,,,,,,,,HCPCS,Unknown,Unknown,Unknown,0.002280644161660289,,shoulder baseplate 25mm cobalt alloy comprehensive reverse taper adapter mini
Prepare Fecal Microbiota for Instil,PX-75000339,CDM,44705,CPT,750.0,RC,,,outpatient,,,548.0,411.0,INTERNATIONAL COMMERCIAL [140001],QUALITY HEALTH MANAGEMENT [14000112],,,72.0,,394.56,73.63,126.16,percent of total billed charges,,CPT,Unknown,Unknown,Unknown,0.0002645007658577554,,prepare fecal microbiota instil
WRIST PLATE 3 HOLE VOLAR FIXED ANGLE RT 7 PEG,SUP-155975,CDM,C1713,HCPCS,278.0,RC,,,inpatient,,,2380.0,1785.0,CENTERS OF EXCELLENCE [1026],CIGNA TRANSPLANT [102602],,,,,,,,,,HCPCS,Unknown,Unknown,Unknown,0.0011487657170452682,,wrist plate 3 hole volar fixed angle rt 7 peg
Protein Total Urine,PX-30000645,CDM,84156,CPT,301.0,RC,,,outpatient,,,61.0,45.75,HARVARD PILGRIM [120001],HARVARD PILGRIM INDEPENDENCE GIC PPO [12000108],,10.26,,,10.26,3.6,27.51,fee schedule,,CPT,Unknown,Unknown,Unknown,2.9436884182908907e-05,,protein total urine
LEAD NEUROSTIMULATOR 60CM LAMITRODE TRIPOLE 16 LEAD,SUP-236148,CDM,C1778,HCPCS,278.0,RC,,,inpatient,,,10000.0,7500.0,HUMANA [1012],HUMANA HMO MEDICARE REPLACEMENT [101201],,,,,,,,,,HCPCS,Unknown,Unknown,Unknown,0.004826767315325207,,lead neurostimulator 60cm lamitrode tripole 16 lead
Leuprolide Vl 5mg/Ml 0.2ml,PX-63600239,CDM,J9218,HCPCS,636.0,RC,,,outpatient,,,389.17,291.88,TUFTS HEALTH PLAN [170001],TUFTS MEDICARE PREFERRED HMO REPLACEMENT [17000103],,,,Paid using APC or APG reimbursement logic. Includes reimbursement for any outliers.,9.02,10.0,19.32,other,OPPS APC,HCPCS,Unknown,Unknown,Unknown,0.00018783872729483215,,leuprolide vl 5mgml 02ml
Platelet Antibody ID,PX-30000780,CDM,86022,CPT,302.0,RC,,,outpatient,,,291.0,218.25,HARVARD PILGRIM [120001],HPHC NH LOCAL CHOICE [12000121],,72.86,,,72.86,18.0,137.9,fee schedule,,CPT,Unknown,Unknown,Unknown,0.00014045268045645036,,platelet antibody id
DIPHENHYDRAMINE 50 MG/ML INJECTION SOLUTION,RX-2508,CDM,J1200,HCPCS,636.0,RC,00641-0376-25,NDC,inpatient,1.0,ML,2.05,1.54,UNITED HEALTHCARE ALTERNATE [1020],UNITED HARVARD PILGRIM PREFERRED A [102002],,,,,,,,,,HCPCS,Unknown,Unknown,Unknown,9.846618452088026e-07,,diphenhydramine 50 mgml injection solution
Place Cath Renal 1st Order Unilat,PX-76001053,CDM,36251,CPT,361.0,RC,,,outpatient,,,9376.0,7032.0,MEDICARE [2001],MEDICARE B [200102],,257.38,,,257.38,257.38,7660.41,fee schedule,,CPT,Unknown,Unknown,Unknown,0.004525576633261338,,place cath renal 1st order unilat
LEVETIRACETAM 500 MG/100 ML IN SODIUM CHLORIDE (ISO-OSM) IV PIGGYBACK,RX-113475,CDM,J1953,HCPCS,636.0,RC,14789-0110-05,NDC,inpatient,100.0,ML,24.65,18.49,MEDICARE MAP ALTERNATE [2004],MEDICARE MAP ALTERNATE [200401],,,,,,,,,,HCPCS,Unknown,Unknown,Unknown,1.1893170522522006e-05,,levetiracetam 500 mg100 ml sodium chloride isoosm iv piggyback
SYSTEM MRSII MALE REMEEX ADJUSTABLE SUI BX/1EA,SUP-634159,CDM,C1713,HCPCS,278.0,RC,,,outpatient,,,12487.5,9365.62,INTERNATIONAL COMMERCIAL [140001],GMMI [14000118],,,65.0,,8116.88,,,percent of total billed charges,,HCPCS,Unknown,Unknown,Unknown,0.006027424068043147,,system mrsii male remeex adjustable sui bx1ea
PERITONEAL DIALYSIS SOLN 7-2.5 % DEXT.LOW CALC 2.5 MEQ/L-MAG 0.5 MEQ/L,RX-27800,CDM,A4722,HCPCS,250.0,RC,00941-0430-53,NDC,inpatient,2500.0,ML,31.88,23.91,CENTERS OF EXCELLENCE [1026],MGBHP TRANSPLANT [102609],,,,,,,,,,HCPCS,Unknown,Unknown,Unknown,1.5381319019928354e-05,,peritoneal dialysis soln 725 dextlow calc 25 meqlmag 05 meql
COVER SHUNT 17MM BURR HOLE CRANIAL MATRIXNEURO TI DRAINAGE,SUP-306386,CDM,C1713,HCPCS,278.0,RC,,,outpatient,,,353.01,264.76,MASSHEALTH [3001],MASSHEALTH COMMUNITY CARE COOPERATIVE C3 ACO [300118],,,,,353.01,,,other,APC grouping requires price history; No contract line matched,HCPCS,Unknown,Unknown,Unknown,0.000170385113411131,,cover shunt 17mm burr hole cranial matrixneuro ti drainage
ENOXAPARIN 120 MG/0.8 ML SUBCUTANEOUS SYRINGE,RX-105904,CDM,J1650,HCPCS,636.0,RC,00548-5606-00,NDC,inpatient,0.8,ML,70.76,53.07,FALLON HEALTH [1008],FALLON MEDICARE REPLACEMENT [100803],,,,,,,,,,HCPCS,Unknown,Unknown,Unknown,3.4147815363907885e-05,,enoxaparin 120 mg08 ml subcutaneous syringe
