description,code|1,code|1|type,code|2,code|2|type,code|3,code|3|type,code|4,code|4|type,setting,drug_unit_of_measurement,drug_type_of_measurement,standard_charge|gross,standard_charge|discounted_cash,payer_name,plan_name,modifiers,standard_charge|negotiated_dollar,standard_charge|negotiated_percentage,standard_charge|negotiated_algorithm,estimated_amount,standard_charge|min,standard_charge|max,standard_charge|methodology,additional_generic_notes,service|type,code|1|description,code|2|description,clinical_domain,pricing|discounted,pricing|gross,description_clean
DORAVIRINE 100 MG TABLET,RX-199301,CDM,25009999,HCPCS,250.0,RC,00006-3069-01,NDC,inpatient,1.0,UN,239.08,179.31,CENTERS OF EXCELLENCE [1026],MGBHP TRANSPLANT [102609],,,,,,,,,,HCPCS,Unknown,Unknown,Unknown,0.00011539207114113614,,doravirine 100 mg tablet
Mgh Cryoablation of Ms Tumor,PX-76001884,CDM,20999,CPT,761.0,RC,,,inpatient,,,2943.0,2207.25,ELDER SERVICES [1037],ELEMENT CARE [103601],,,,,,,,,,CPT,Unknown,Unknown,Unknown,0.0014205130792278935,,mgh cryoablation ms tumor
ANTENNA PROBE 16GX123CMFLEXIBLE MICROWAVE SMALL,SUP-678937,CDM,C1886,HCPCS,272.0,RC,,,inpatient,,,7000.0,5250.0,BLUE CROSS BLUE SHIELD [110001],BLUE CROSS OUT OF STATE POS [11000142],,,,,,,,,,HCPCS,Unknown,Unknown,Unknown,0.0033787351900181448,,antenna probe 16gx123cmflexible microwave small
CATHETER OPTICROSS 5FR 6MM 135CM .014IN CORONARY ULTRASOUND PROXIMAL IVUS IMAGING TRILON POLYMER BIO SLIDE COATED,SUP-423544,CDM,C1753,HCPCS,272.0,RC,,,inpatient,,,2555.0,1916.25,MEDICARE [2001],MEDICARE PART A & B [200103],,,,,,,,,,HCPCS,Unknown,Unknown,Unknown,0.0012332342576881802,,catheter opticross 5fr 6mm 135cm 014in coronary ultrasound proximal ivus imaging trilon polymer bio slide coated
Initial Care Newborn Not in Hospita,PX-51000096,CDM,99461,CPT,510.0,RC,,,outpatient,,,408.0,306.0,AETNA [1001],AETNA PPO MEDICARE REPLACEMENT [100103],,,,,408.0,,,other,APC grouping requires price history; No contract line matched,CPT,Unknown,Unknown,Unknown,0.0001969259333434258,,initial care newborn hospita
STENT GRAFT 18FR 23X13 166MM AORTIC ENDURANT II NITINOL POLYESTER BIFURCATED EXTENSION,SUP-445751,CDM,C1874,HCPCS,278.0,RC,,,inpatient,,,25935.0,19451.25,MGB HEALTH PLAN [150001],MGBHP PPO MEDICARE REPLACEMENT [15000116],,,,,,,,,,HCPCS,Unknown,Unknown,Unknown,0.01251823128758122,,stent graft 18fr 23x13 166mm aortic endurant ii nitinol polyester bifurcated extension
Tissue Exam Koh Skin/Hair/Nail,PX-30001197,CDM,87220,CPT,306.0,RC,,,outpatient,,,73.0,54.75,BLUE CROSS BLUE SHIELD [110001],BLUE CROSS MA HMO POS [11000103],,13.31,,,13.31,4.18,32.08,fee schedule,,CPT,Unknown,Unknown,Unknown,3.522901268413716e-05,,tissue exam koh skinhairnail
Herpes Simplex Type I Antibody,PX-30000946,CDM,86695,CPT,302.0,RC,,,outpatient,,,158.0,118.5,TUFTS HEALTH PLAN ALTERNATE [170002],TUFTS CARELINK HYBRID [17000203],,77.92,,,77.92,12.93,98.99,fee schedule,,CPT,Unknown,Unknown,Unknown,7.625658956783727e-05,,herpes simplex type antibody
ANCHOR BONE 12MM VERTEBRAL BODY,SUP-666862,CDM,C1713,HCPCS,278.0,RC,,,inpatient,,,2800.0,2100.0,MEDICAID NON MASSACHUSETTS [3002],GENERIC MEDICAID OUT OF STATE [300203],,,,,,,,,,HCPCS,Unknown,Unknown,Unknown,0.001351490214588257,,anchor bone 12mm vertebral body
BONE SCREW 12.7X22 90MM LAG S/S CANC SELF TAP CANNULATED NON LOCK,SUP-98963,CDM,C1713,HCPCS,278.0,RC,,,inpatient,,,1026.94,770.2,HARVARD PILGRIM [120001],HPHC NH LOCAL HMO [12000122],,,,,,,,,,HCPCS,Unknown,Unknown,Unknown,0.0004956710500401096,,bone screw 127x22 90mm lag ss canc self tap cannulated non lock
"IGG 10 GRAM/100 ML (10 %)-HYALURONIDASE,RECOMB. SUBCUTANEOUS SOLUTION",RX-179568,CDM,J1575,HCPCS,636.0,RC,00944-2512-02,NDC,outpatient,100.0,ML,7207.58,5405.68,HARVARD PILGRIM [120001],HARVARD PILGRIM INDEPENDENCE GIC PPO [12000108],,2137.44,,,2137.44,1904.11,4142.0,fee schedule,,HCPCS,Unknown,Unknown,Unknown,0.003478926141692724,,igg 10 gram100 ml 10 hyaluronidaserecomb subcutaneous solution
"Malignancy, Male Reproductive System With McC",722,MS-DRG,,,,,,,inpatient,,,305044.48,228783.36,ELDER SERVICES [1037],ELEMENT CARE [103601],,13075.58,,"Wage-adjusted base payment rate plus any adjustments related to capital costs, indirect medical education (IME), disproportionate share hospital (DSH) adjustors, new technology, hemophilia, sole community hospital (SCH) and Medicare Dependent Hospital (MDH) adjustors, transfers, and outliers.",22755.47,5997.11,60254.1,other,Inpatient Replacement Plans DRG,MS-DRG,Unknown,Unknown,Unknown,0.14723806246016424,,malignancy male reproductive system mcc
HIP SHELL SIZE 70 HEMISPHERICAL RESTORATION RIGHT,SUP-499022,CDM,C1776,HCPCS,278.0,RC,,,inpatient,,,6012.5,4509.37,TUFTS HEALTH PLAN [170001],TUFTS NAVIGATOR PPO [17000112],,,,,,,,,,HCPCS,Unknown,Unknown,Unknown,0.0029020880642554024,,hip shell size 70 hemispherical restoration right
HYDROCHLOROTHIAZIDE 12.5 MG TABLET,RX-76988,CDM,25009999,HCPCS,250.0,RC,16729-0182-01,NDC,inpatient,1.0,UN,0.09,0.07,MGB HEALTH PLAN [150001],MGBHP ALLIES [15000111],,,,,,,,,,HCPCS,Unknown,Unknown,Unknown,3.861419000818834e-08,,hydrochlorothiazide 125 mg tablet
Hm Universal Battery Charger-Refurb,PX-27001053,CDM,Q0495,HCPCS,274.0,RC,,,outpatient,,,473.0,354.75,INTERNATIONAL COMMERCIAL [140001],BERMUDA GEHI [14000105],,,78.0,,368.94,7343.97,12405.69,percent of total billed charges,,HCPCS,Unknown,Unknown,Unknown,0.0002282999627250788,,hm universal battery chargerrefurb
Mghdrug Screen Quant Everolimus,PX-30002278,CDM,80169,CPT,301.0,RC,,,inpatient,,,116.0,87.0,INTERNATIONAL COMMERCIAL [140001],BERMUDA FIRE & MARINE (BF&M) [14000104],,,77.5,,89.9,,,percent of total billed charges,,CPT,Unknown,Unknown,Unknown,5.598413981353839e-05,,mghdrug screen quant everolimus
LEVALBUTEROL 1.25 MG/3 ML SOLUTION FOR NEBULIZATION,RX-24916,CDM,J7614,HCPCS,250.0,RC,76204-0900-01,NDC,outpatient,3.0,ML,6.29,4.72,BLUE CROSS BLUE SHIELD [110001],BLUE CROSS ANTHEM NH HMO POS [11000118],,,67.23,,4.23,,,percent of total billed charges,,HCPCS,Unknown,Unknown,Unknown,3.031213915642784e-06,,levalbuterol 125 mg3 ml solution nebulization
SPINE ROD 6X500MM SMOOTH J POSTERIOR RIGHT,SUP-167499,CDM,C1889,HCPCS,278.0,RC,,,inpatient,,,4572.5,3429.37,GENERIC MEDICARE REPLACEMENT [1010],GENERIC MEDICARE REPLACEMENT [101001],,,,,,,,,,HCPCS,Unknown,Unknown,Unknown,0.0022070326441080124,,spine rod 6x500mm smooth j posterior right
HYDROCOIL AZUR 8MM 15CM .035IN DETACHABLE EMBOLIZATION HYDROGEL BX/1EA,SUP-359172,CDM,C1889,HCPCS,278.0,RC,,,outpatient,,,4165.0,3123.75,MGB HEALTH PLAN [150001],MGBHP GIC COMPLETE HMO [15000118],,,36.2,,1507.73,,,percent of total billed charges,,HCPCS,Unknown,Unknown,Unknown,0.002010344831602971,,hydrocoil azur 8mm 15cm 035in detachable embolization hydrogel bx1ea
Therapeutic Behavioral per 15 Min,PX-90000046,CDM,H2019,HCPCS,914.0,RC,,,outpatient,,,142.0,106.5,COMMONWEALTH CARE ALLIANCE [1007],COMMONWEALTH CARE ALLIANCE ONE CARE MEDICARE REPLACEMENT [100702],,,,,142.0,17.19,17.22,other,APC grouping requires price history; No contract line matched,HCPCS,Unknown,Unknown,Unknown,6.853375156619959e-05,,therapeutic behavioral per 15 min
HC Tlssc Control Rigid Shell 2 Plastic Tier1,PX-27000274,CDM,L0491,HCPCS,274.0,RC,,,outpatient,,,1512.0,1134.0,WELLPOINT [1015],WELLPOINT GIC DENTAL [101503],,,74.45,,1125.68,1347.67,2276.52,percent of total billed charges,,HCPCS,Unknown,Unknown,Unknown,0.0007298017554564248,,hc tlssc control rigid shell 2 plastic tier1
"Ifr (During Dx/Pci Coronary Artery), Ea Addl Vessel",PX-48000492,CDM,93799,CPT,481.0,RC,,,outpatient,,,2003.0,1502.25,TUFTS HEALTH PUBLIC PLANS [1013],TUFTS PUBLIC PLANS ONE CARE MEDICARE REPLACEMENT [101304],,,,Paid using APC or APG reimbursement logic. Includes reimbursement for any outliers.,167.08,201.81,354.83,other,OPPS APC,CPT,Unknown,Unknown,Unknown,0.0009667963466316807,,ifr dxpci coronary artery ea addl vessel
PLATE BRIDGING 150MM 5/8 EXTERNAL FIXATION MAXFRAME ALUMINUM,SUP-650268,CDM,,,270.0,RC,,,outpatient,,,3564.27,2673.2,INTERNATIONAL COMMERCIAL [140001],CG CORALISLE COLONIAL [14000109],,,78.0,,2780.13,,,percent of total billed charges,,CDM,Unknown,Unknown,Unknown,0.0017203844431331495,,plate bridging 150mm 58 external fixation maxframe aluminum
SPINAL ROD 5.5X150MM CURVED MIS CREO TITANIUM ALLOY,SUP-686903,CDM,C1713,HCPCS,278.0,RC,,,inpatient,,,840.0,630.0,WELLSENSE [1003],WELLSENSE BMC EPO [100305],,,,,,,,,,HCPCS,Unknown,Unknown,Unknown,0.0004054425593876428,,spinal rod 55x150mm curved mis creo titanium alloy
Extraocular Procedures Except Orbit,115,MS-DRG,,,,,,,inpatient,,,136432.79,102324.59,MASSHEALTH [3001],MASSHEALTH QMB [300119],,5565.31,,"Base payment rate plus any adjustments related to capital costs, transfers and outliers.",7789.67,5565.31,22722.9,case rate,,MS-DRG,Unknown,Unknown,Unknown,0.0658530129104678,,extraocular procedures except orbit
BONE PLATE 4.5X368MM 20 HOLE LCP SS BROAD,SUP-84832,CDM,C1713,HCPCS,278.0,RC,,,inpatient,,,3258.22,2443.66,GENERIC MEDICARE REPLACEMENT [1010],NEIGHBORHOOD HEALTH PLAN RI SCO MEDICARE REPLACEMENT [101008],,,,,,,,,,HCPCS,Unknown,Unknown,Unknown,0.0015726594235584903,,bone plate 45x368mm 20 hole lcp ss broad
THORACOLUMBAR CAGE 17X22 32MM SPACER SYNMESH TI MESH OBLONG,SUP-44463,CDM,C1821,HCPCS,278.0,RC,,,inpatient,,,5250.0,3937.5,INTERNATIONAL COMMERCIAL [140001],CG CORALISLE COLONIAL [14000109],,,77.5,,4068.75,,,percent of total billed charges,,HCPCS,Unknown,Unknown,Unknown,0.002534049783589025,,thoracolumbar cage 17x22 32mm spacer synmesh ti mesh oblong
Real-Time Rt-Pcr Panel for Detection 2019-Novel Coronavirus,PX-30003639,CDM,U0001,HCPCS,300.0,RC,,,inpatient,,,0.01,0.01,MGB HEALTH PLAN [150001],MGBHP RISK MGB PCP [15000109],,,,,,,,,,HCPCS,Unknown,Unknown,Unknown,0.0,,realtime rtpcr panel detection 2019novel coronavirus
CATHETER TURNPIKE 135CM LP,SUP-482071,CDM,C1887,HCPCS,272.0,RC,,,inpatient,,,1890.0,1417.5,CIGNA [1006],CIGNA MVP MEDICARE REPLACEMENT [100610],,,,,,,,,,HCPCS,Unknown,Unknown,Unknown,0.0009122538032451147,,catheter turnpike 135cm lp
Atxn2 Gene Analysis Eval Detect Abnormal Alleles,PX-31000955,CDM,81179,CPT,310.0,RC,,,outpatient,,,1611.0,1208.25,VETERANS ADMINISTRATION [160006],VETERANS ADMINISTRATION OF NH [16000604],,137.0,,,137.0,134.26,542.52,fee schedule,,CPT,Unknown,Unknown,Unknown,0.0007775868155915579,,atxn2 gene analysis eval detect abnormal alleles
I&D Absc Rtrphrngl/Parapharyngeal Xtrnl Appr,PX-75000063,CDM,42725,CPT,761.0,RC,,,outpatient,,,12038.0,9028.5,TUFTS HEALTH PLAN ALTERNATE [170002],TUFTS CARELINK BLENDED [17000211],,4191.77,,,12038.0,3981.81,5059.36,other,Surgical CPT ,CPT,Unknown,Unknown,Unknown,0.005810463805783805,,id absc rtrphrnglparapharyngeal xtrnl appr
SCREW SPINE 4X14MM SELF TAPPING POLYAXIAL,SUP-507798,CDM,C1821,HCPCS,278.0,RC,,,inpatient,,,385.0,288.75,HEALTH NEW ENGLAND ALTERNATE [1047],HEALTH NEW ENGLAND MBHP [104701],,,,,,,,,,HCPCS,Unknown,Unknown,Unknown,0.00018582435371607164,,screw spine 4x14mm self tapping polyaxial
IOPAMIDOL 370 MG IODINE/ML (76 %) INTRAVENOUS SOLUTION,RX-10328,CDM,Q9967,HCPCS,636.0,RC,00270-1316-95,NDC,inpatient,50.0,ML,118.36,88.77,VETERANS ADMINISTRATION [160006],VETERANS ADMINISTRATION SPECIAL BILLING [16000605],,,,,,,,,,HCPCS,Unknown,Unknown,Unknown,5.712325841877994e-05,,iopamidol 370 mg iodineml 76 intravenous solution
DEXMEDETOMIDINE 400 MCG/100 ML (4 MCG/ML) IN 0.9 % SODIUM CHLORIDE IV,RX-161783,CDM,25009998,HCPCS,250.0,RC,00143-9525-10,NDC,outpatient,100.0,ML,53.13,39.85,COVID19 HRSA UNINSURED TESTING AND TREATMENT FUND [160008],COVID19 HRSA UNINSURED TESTING AND TREATMENT FUND [16000801],,,,,53.13,,,other,APC grouping requires price history; No contract line matched,HCPCS,Unknown,Unknown,Unknown,2.5639822165437056e-05,,dexmedetomidine 400 mcg100 ml 4 mcgml 09 sodium chloride iv
Revsc Fem/Pop Art W/Stent& Arthc,PX-76001155,CDM,37227,CPT,361.0,RC,,,outpatient,,,19164.0,14373.0,HARVARD PILGRIM [120001],HPHC NH LOCAL CHOICE [12000121],,13819.05,,,30816.48,713.65,32982.48,other,Multiple Surgery,CPT,Unknown,Unknown,Unknown,0.00925002278076318,,revsc fempop art wstent arthc
Xr Catheter Pancreatic Only,PX-32000218,CDM,74329,CPT,320.0,RC,,,inpatient,,,1506.0,1129.5,INTERNATIONAL COMMERCIAL [140001],AETNA INTERNATIONAL [14000102],,,77.5,,1167.15,,,percent of total billed charges,,CPT,Unknown,Unknown,Unknown,0.0007269056912058107,,xr catheter pancreatic
G230288 Vitalyst Temp Ventricular Support 2023p003078,PX-62400290,CDM,,,624.0,RC,,,inpatient,,,1.0,0.75,CHAMPVA [160001],CHAMPVA [16000101],,,,,,,,,,CDM,Unknown,Unknown,Unknown,4.762416767676562e-07,,g230288 vitalyst temp ventricular support 2023p003078
CRIZOTINIB 250 MG CAPSULE,RX-111399,CDM,25009999,HCPCS,259.0,RC,00069-8140-20,NDC,outpatient,250.0,ME,1588.61,,MEDICARE ALTERNATE [2002],MEDICARE NHIC PRO [200201],,,,,1588.61,,,other,APC grouping requires price history; No contract line matched,HCPCS,Unknown,Unknown,Unknown,,,crizotinib 250 mg capsule
Pf Colposcopy Entire Vagina,PX-98300388,CDM,57420,CPT,983.0,RC,,,inpatient,,,385.0,288.75,HARVARD PILGRIM [120001],HPHC CONNECTORCARE [12000126],,,,,,273.0,273.0,,,CPT,Unknown,Unknown,Unknown,0.00018582435371607164,,pf colposcopy entire vagina
"IRREVERSIBLE ELECTROPORATION (IRE) TUMOR(s), PER ORGAN",PX-76002169,CDM,0600T,CPT,761.0,RC,,,inpatient,,,3329.0,2496.75,INTERNATIONAL COMMERCIAL [140001],ONE TEAM HEALTH [14000119],,,,,,,,,,CPT,Unknown,Unknown,Unknown,0.0016068265460174023,,irreversible electroporation ire tumors per organ
Laryngoscopy Direct With Biopsy,PX-76002335,CDM,31535,CPT,761.0,RC,,,outpatient,,,5112.0,3834.0,MGB HEALTH PLAN [150001],MGBHP PPO [15000107],,,38.0,,1942.56,2466.59,4191.77,percent of total billed charges,,CPT,Unknown,Unknown,Unknown,0.0024674403058249,,laryngoscopy direct biopsy
"Circulatory Disorders Except Ami, With Cardiac Catheterization With McC",286,MS-DRG,,,,,,,inpatient,,,131834.88,98876.16,MGB HEALTH PLAN [150001],MGBHP MY CARE FAMILY ACO [15000108],,6985.2,,"Base payment rate plus any adjustments related to capital costs, transfers and outliers.",35056.67,6985.2,120298.24,case rate,,MS-DRG,Unknown,Unknown,Unknown,0.06363370738963552,,circulatory disorders except ami cardiac catheterization mcc
Pf Biopsy/Exc Lymph Node Super Ndl,PX-98300318,CDM,38505,CPT,983.0,RC,,,outpatient,,,364.0,273.0,BLUE CROSS BLUE SHIELD [110001],BLUE CROSS OUT OF STATE HMO MEDICARE REPLACEMENT [11000120],,89.51,,,89.51,89.51,1756.21,fee schedule,,CPT,Unknown,Unknown,Unknown,0.0001756881288389222,,pf biopsyexc lymph node super ndl
BONE PLATE 2.4MM 2.7 5X12 HOLE VA LCP SS MESH LOCKING,SUP-367856,CDM,C1713,HCPCS,278.0,RC,,,inpatient,,,4457.39,3343.04,WELLPOINT [1015],WELLPOINT GIC TOTAL CHOICE INDEMNITY [101501],,,,,,,,,,HCPCS,Unknown,Unknown,Unknown,0.0021514732603845643,,bone plate 24mm 27 5x12 hole va lcp ss mesh locking
MICROSPHERE EMBOLIZATION 100UM 2ML EMBOZENE SYRINGE ORANGE,SUP-218668,CDM,C1889,HCPCS,278.0,RC,,,inpatient,,,682.5,511.87,TUFTS HEALTH PLAN ALTERNATE [170002],TUFTS CARELINK NON PREFERRED [17000202],,,,,,,,,,HCPCS,Unknown,Unknown,Unknown,0.00032941765495985467,,microsphere embolization 100um 2ml embozene syringe orange
G200183 Lazer Lithotripsy Renal Applaud Trial 2021p002683,PX-62400242,CDM,,,624.0,RC,,,inpatient,,,1.0,0.75,BLUE CROSS BLUE SHIELD [110001],BLUE CROSS SELECT LIMITED NETWORK HMO [11000117],,,,,,,,,,CDM,Unknown,Unknown,Unknown,4.762416767676562e-07,,g200183 lazer lithotripsy renal applaud trial 2021p002683
Rem/Reinsert Impl Drug Delivery,PX-76000105,CDM,11983,CPT,761.0,RC,,,inpatient,,,1165.0,873.75,MEDICARE ALTERNATE [2002],MEDICARE RAILROAD PROF [200202],,,,,,776.4,818.18,,,CPT,Unknown,Unknown,Unknown,0.0005623127062959079,,remreinsert impl drug delivery
BONE PLATE 4.5X151MM 8 HOLE LCP SS RECONSTRUCTION STRAIGHT,SUP-180680,CDM,C1713,HCPCS,278.0,RC,,,outpatient,,,1427.09,1070.32,BLUE CROSS BLUE SHIELD [110001],BLUE CROSS MA INDEMNITY [11000104],,,61.88,,883.08,,,percent of total billed charges,,HCPCS,Unknown,Unknown,Unknown,0.0006888192284610676,,bone plate 45x151mm 8 hole lcp ss reconstruction straight
ROPIVACAINE (PF) 10 MG/ML (1 %) INJECTION SOLUTION,RX-18194,CDM,J2795,HCPCS,636.0,RC,63323-0288-11,NDC,outpatient,10.0,ML,15.22,11.41,CENTERS OF EXCELLENCE [1026],AETNA TRANSPLANT [102601],,,65.6,,9.98,17.0,17.0,percent of total billed charges,,HCPCS,Unknown,Unknown,Unknown,7.336696101555783e-06,,ropivacaine pf 10 mgml 1 injection solution
MINOCYCLINE 100 MG INTRAVENOUS SOLUTION,RX-10612,CDM,J2265,HCPCS,636.0,RC,70842-0160-10,NDC,inpatient,5.0,ML,1066.33,799.75,HUMANA [1012],HUMANA HMO MEDICARE REPLACEMENT [101201],,,,,,,,,,HCPCS,Unknown,Unknown,Unknown,0.0005146885386191423,,minocycline 100 mg intravenous solution
CHERRY FLAVOR (BULK) ORAL LIQUID,RX-1562,CDM,25009999,HCPCS,250.0,RC,00395-2662-16,NDC,outpatient,473.0,ML,46.24,34.68,MEDICAID NON MASSACHUSETTS [3002],CONNECTICUT MEDICAID [300201],,,,,46.24,,,other,APC grouping requires price history; No contract line matched,HCPCS,Unknown,Unknown,Unknown,2.231256612639816e-05,,cherry flavor bulk oral liquid
Rad Treat Intraop Xray Single,PX-33000050,CDM,77424,CPT,333.0,RC,,,outpatient,,,6635.0,4976.25,TUFTS HEALTH PLAN ALTERNATE [170002],TUFTS CARELINK NON CONFORMING [17000204],,11744.55,,,10284.25,6879.82,24869.94,fee schedule,,CPT,Unknown,Unknown,Unknown,0.0032025579481057853,,rad treat intraop xray single
MESH HERNIA 2.25X5IN PROLENE POLYPROPYLENE EXTENDED BX/3EA,SUP-83519,CDM,C1781,HCPCS,278.0,RC,,,inpatient,,,793.24,594.93,TRICARE [160005],TRICARE WEST REGION [16000503],,,,,,,,,,HCPCS,Unknown,Unknown,Unknown,0.00038287256532785666,,mesh hernia 225x5in prolene polypropylene extended bx3ea
Bwh Histone Ab,PX-30002819,CDM,83520,CPT,301.0,RC,,,inpatient,,,213.0,159.75,BLUE CROSS BLUE SHIELD [110001],BLUE CROSS OUT OF STATE PPO MEDICARE REPLACEMENT [11000111],,,,,,,,,,CPT,Unknown,Unknown,Unknown,0.00010280384519846674,,bwh histone ab
Colon Cancer Scr Sigmoidoscopy,PX-75000328,CDM,G0104,HCPCS,750.0,RC,,,inpatient,,,1598.0,1198.5,CIGNA ALTERNATE [1018],TUFTS CIGNA CARELINK NON PREFERRED [101803],,,,,,744.89,744.89,,,HCPCS,Unknown,Unknown,Unknown,0.0007713120097152272,,colon cancer scr sigmoidoscopy
RISPERIDONE 1 MG/ML ORAL SOLUTION,RX-17377,CDM,25009999,HCPCS,259.0,RC,27808-0002-01,NDC,inpatient,30.0,ML,49.98,,ELDER SERVICES [1037],ELEMENT CARE [103601],,,,,,,,,,HCPCS,Unknown,Unknown,Unknown,,,risperidone 1 mgml oral solution
Appl Splint Leg Long,PX-76000719,CDM,29505,CPT,510.0,RC,,,outpatient,,,346.0,259.5,TUFTS HEALTH PLAN [170001],TUFTS NAVIGATOR POS [17000113],,358.9,,,346.0,57.24,577.43,fee schedule,,CPT,Unknown,Unknown,Unknown,0.00016699993608707984,,appl splint leg long
EPHEDRINE (PF) 15 MG/3 ML (5 MG/ML) IN 0.9% SODIUM CHLORIDE IV SYRINGE,RX-206202,CDM,25009998,HCPCS,250.0,RC,71506-0022-35,NDC,outpatient,3.0,ML,56.78,42.58,TRICARE [160005],TRICARE EAST REGION PRIME [16000501],,,,,56.78,,,other,APC grouping requires price history; No contract line matched,HCPCS,Unknown,Unknown,Unknown,2.7396767810809622e-05,,ephedrine pf 15 mg3 ml 5 mgml 09 sodium chloride iv syringe
Mgh Immunodiffusion Not Specified,PX-30001882,CDM,86329,CPT,300.0,RC,,,outpatient,,,226.0,169.5,UNITED HEALTHCARE [1016],UNITED SCO ERICKSON MEDICARE REPLACEMENT [101630],,13.77,,,13.77,13.77,105.41,fee schedule,,CPT,Unknown,Unknown,Unknown,0.00010907865107479735,,mgh immunodiffusion specified
ILOPERIDONE 1 MG TABLET,RX-99453,CDM,25009999,HCPCS,250.0,RC,43068-0101-02,NDC,outpatient,1.0,UN,117.19,87.89,CIGNA ALTERNATE [1018],TUFTS CIGNA CARELINK NON PREFERRED [101803],,,56.4,,66.1,,,percent of total billed charges,,HCPCS,Unknown,Unknown,Unknown,5.655691696532652e-05,,iloperidone 1 mg tablet
SYSTEM CLOSURE PROGLIDE 6FR SUTURE PERCLOSE MEDICATED SNARED KNOT PUSHER TRIMMER BX/10EA,SUP-84800,CDM,C1760,HCPCS,278.0,RC,,,inpatient,,,612.5,459.37,UNITED HEALTHCARE [1016],UNITED SCO COMMUNITY MEDICARE REPLACEMENT [101601],,,,,,,,,,HCPCS,Unknown,Unknown,Unknown,0.0002956302387026899,,system closure proglide 6fr suture perclose medicated snared knot pusher trimmer bx10ea
PHENOL 1.4 % MUCOSAL AEROSOL SPRAY,RX-36976,CDM,25009999,HCPCS,259.0,RC,00904-6305-21,NDC,inpatient,177.0,ML,9.78,,ELDER SERVICES [1037],PEAK PACE SOLUTIONS [103605],,,,,,,,,,HCPCS,Unknown,Unknown,Unknown,,,phenol 14 mucosal aerosol spray
Pf Inj Lumbar Epidural Blood Patch,PX-98300417,CDM,62273,CPT,983.0,RC,,,outpatient,,,588.0,441.0,TUFTS HEALTH PLAN ALTERNATE [170002],TUFTS CARELINK PREFERRED [17000201],,1756.21,,,1808.9,118.99,1756.21,other,Surgical CPT ,CPT,Unknown,Unknown,Unknown,0.00028380786086184954,,pf inj lumbar epidural blood patch
Mgh Ph Stool,PX-30002146,CDM,83986,CPT,301.0,RC,,,outpatient,,,57.0,42.75,SENIOR WHOLE HEALTH [1014],SENIOR WHOLE HEALTH CHOICE CARE MEDICARE REPLACEMENT [101406],,3.58,,,3.58,3.51,26.84,fee schedule,,CPT,Unknown,Unknown,Unknown,2.750617468249949e-05,,mgh ph stool
Dest Lesion Vagina Smp,PX-76001344,CDM,57061,CPT,761.0,RC,,,inpatient,,,4738.0,3553.5,CENTERS OF EXCELLENCE [1026],MGBHP TRANSPLANT [102609],,,,,,2125.14,2125.14,,,CPT,Unknown,Unknown,Unknown,0.0022869189675366196,,dest lesion vagina smp
DILTIAZEM 120 MG EXTENDED-RELEASE 24 HR SUPER ORDERABLE,RX-701780,CDM,25009999,HCPCS,250.0,RC,60687-0195-01,NDC,outpatient,1.0,UN,1.41,1.06,BLUE CROSS BLUE SHIELD [110001],BLUE CROSS OUT OF STATE PPO [11000112],,,62.71,,0.88,,,percent of total billed charges,,HCPCS,Unknown,Unknown,Unknown,6.757483251432959e-07,,diltiazem 120 mg extendedrelease 24 hr super orderable
CATHETER OPTA 5FR 5MM 20MM 80CM .035IN PRO OTW PTA NITINOL LOW PROFILE MODERATE PRESSURE PERIPHERAL,SUP-43617,CDM,C1725,HCPCS,272.0,RC,,,inpatient,,,367.5,275.62,MGB HEALTH PLAN [150001],MGBHP MY CARE FAMILY ACO [15000108],,,,,,,,,,HCPCS,Unknown,Unknown,Unknown,0.0001773742818026131,,catheter opta 5fr 5mm 20mm 80cm 035in pro otw pta nitinol low profile moderate pressure peripheral
CATHETER VASCULAR 9.0FR 100CMX32MM 0.035IN CODA POLYURETHANE BALLOON OCCLUDING,SUP-481543,CDM,C2628,HCPCS,272.0,RC,,,inpatient,,,1674.75,1256.06,WELLPOINT [1015],WELLPOINT GIC TOTAL CHOICE INDEMNITY [101501],,,,,,,,,,HCPCS,Unknown,Unknown,Unknown,0.0008083558893297492,,catheter vascular 90fr 100cmx32mm 0035in coda polyurethane balloon occluding
Cltx Carpal Bone Fx W/Manj Each Bone,PX-76000467,CDM,25635,CPT,761.0,RC,,,inpatient,,,2782.0,2086.5,CIGNA [1006],CIGNA CARELINK PPO [100601],,,,,,,,,,CPT,Unknown,Unknown,Unknown,0.0013428020218364145,,cltx carpal bone fx wmanj bone
Methylene Blue Injection Non-Sentinel,PX-76002682,CDM,38999,CPT,761.0,RC,,,inpatient,,,1057.0,792.75,MGB HEALTH PLAN [150001],MGBHP PPO [15000107],,,,,,,,,,CPT,Unknown,Unknown,Unknown,0.0005101835497848537,,methylene blue injection nonsentinel
FOSCARNET 24 MG/ML INTRAVENOUS SOLUTION,RX-10093,CDM,J1455,HCPCS,636.0,RC,76310-0024-45,NDC,inpatient,250.0,ML,1885.94,1414.45,HARVARD PILGRIM [120001],HPHC ELEVATE OPTIONS [12000113],,,,,,,,,,HCPCS,Unknown,Unknown,Unknown,0.0009102909152530318,,foscarnet 24 mgml intravenous solution
CINACALCET 90 MG TABLET,RX-38102,CDM,J0604,HCPCS,250.0,RC,65862-0833-30,NDC,inpatient,1.0,UN,5.02,3.76,MGB HEALTH PLAN [150001],MGBHP PPO [15000107],,,,,,,,,,HCPCS,Unknown,Unknown,Unknown,2.413386875511771e-06,,cinacalcet 90 mg tablet
Mgh Doxycycline Level Ba,PX-30001524,CDM,80299,CPT,301.0,RC,,,outpatient,,,274.0,205.5,HARVARD PILGRIM [120001],HPHC ELEVATE OPTIONS [12000113],,66.54,,,66.54,18.27,102.84,fee schedule,,CPT,Unknown,Unknown,Unknown,0.00013224716507971034,,mgh doxycycline level ba
CATHETER URETERAL 3FRX70CM WHISTLE TIP PVC RT URETER BX/10EA,SUP-320553,CDM,C1758,HCPCS,272.0,RC,,,inpatient,,,38.47,28.85,HARVARD PILGRIM ALTERNATE [120002],HARVARD PILGRIM UNITED PREFERRED B [12000203],,,,,,,,,,HCPCS,Unknown,Unknown,Unknown,1.8560553997269194e-05,,catheter ureteral 3frx70cm whistle tip pvc rt ureter bx10ea
Tx Fx Ankle Bimalleolar W/Man Clsd,PX-76000617,CDM,27810,CPT,761.0,RC,,,outpatient,,,2733.0,2049.75,GENERIC MEDICARE REPLACEMENT [1010],WELLCARE HMO MEDICARE REPLACEMENT [101003],,,,,2733.0,1182.01,1756.21,other,APC grouping requires price history; No contract line matched,CPT,Unknown,Unknown,Unknown,0.0013191508304563992,,tx fx ankle bimalleolar wman clsd
METOPROLOL TARTRATE 5 MG/5 ML INTRAVENOUS SOLUTION,RX-5007,CDM,J3490,HCPCS,636.0,RC,00143-9873-25,NDC,inpatient,2.5,ML,0.89,0.67,MGB HEALTH PLAN [150001],MGBHP EMPLOYEES FAMILY [15000110],,,,,,,,,,HCPCS,Unknown,Unknown,Unknown,4.2475609009007174e-07,,metoprolol tartrate 5 mg5 ml intravenous solution
KIT PEG 20FR GASTROTOMY PERCUNTANEOUS ENDOSCOPIC,SUP-493685,CDM,,,272.0,RC,,,outpatient,,,456.51,342.38,HEALTH NEW ENGLAND [1034],HEALTH NEW ENGLAND CONNECTOR CARE [103102],,,,,456.51,,,other,APC grouping requires price history; No contract line matched,CDM,Unknown,Unknown,Unknown,0.00022033900388505732,,kit peg 20fr gastrotomy percuntaneous endoscopic
US Guided Ova Aspiration,PX-40000079,CDM,76948,CPT,402.0,RC,,,outpatient,,,383.0,287.25,TUFTS HEALTH PLAN [170001],TUFTS SENIOR CARE OPTION MEDICARE REPLACEMENT [17000111],,,,,383.0,261.88,261.88,other,APC grouping requires price history; No contract line matched,CPT,Unknown,Unknown,Unknown,0.00018485899896586693,,us guided ova aspiration
CAMPHOR TOPICAL SPIRITS,RX-1338,CDM,25009999,HCPCS,250.0,RC,00395-0467-92,NDC,outpatient,60.0,ML,13.52,10.14,MEDICAID NON MASSACHUSETTS [3002],FLORIDA MEDICAID [300202],,,,,13.52,,,other,APC grouping requires price history; No contract line matched,HCPCS,Unknown,Unknown,Unknown,6.51936241304913e-06,,camphor topical spirits
Rotterdam Symphysis Distractor,PX-27001093,CDM,,,278.0,RC,,,inpatient,,,6737.3,5052.97,ELDER SERVICES [1037],ELDER SERVICE NEIGHBORHOOD PACE [103602],,,,,,,,,,CDM,Unknown,Unknown,Unknown,0.003251932625729589,,rotterdam symphysis distractor
Preventive Med Estab 1-4 Yrs,PX-77000009,CDM,99392,CPT,770.0,RC,,,inpatient,,,233.0,174.75,MEDICARE ALTERNATE [2002],MEDICARE RAILROAD PROF [200202],,,,,,,,,,CPT,Unknown,Unknown,Unknown,0.00011245739270051383,,preventive med estab 14 yrs
